,unique_id,city,job_qry,job_title,company_name,location,summary,salary,link,date
447,pj_712a395f5bbb04b8,Boston,data+analyst,QA Data Analyst,HP HOOD,NOT_FOUND,QA Data Analyst - HP Hood. Presents numerical data effectively. Publish data trend analysis reports. Work with department directors to assure data accuracy ....,NOT_FOUND,https://www.indeed.com/pagead/clk?mo=r&ad=-6NYlbfkN0CybCVwhmkLTCIiqD1-ZFQUpj9tFoSiLejrbuvZUvGjhYWHpqHXQ_ylJ37Z_W_bsjcrwm3pRzBKIr8HUuT_KYdfwqQtpd1STWfyyTjtu9tnEEcYONzp-E4RKkCLc4GeCqTyRepGzv_wrlJz-qt8UOhnwYdjMVRxhbeVc29mdh8neBCddrvJ1SGxI3BpxNtI2aZYxxv_uqBTYMSccJYvJhP9cw259LD9gPPeryrQkUl-zg7EWJ2QWodvK6wsnqnYUtxiwTFRFcFgmpfD1TdPpiykopC6ENTUOnGieM9BS8j6EnFv4e6-0X7XU3HrJlhwTWvEmlMWMkyMqQLtpNkQmk9OTlaQgKxM5RFwUjXojde4CXpbIMjLEKvdhNSM362i7ArwHyywArk1X9UT7nd-FVXLAg7fRcFh3HpN2Jwuz0Lavp0x5_ItUSxu&p=14&fvj=1&vjs=3,1 day ago
448,pj_37976f5481a32076,Boston,data+analyst,Data Analyst II,CodaMetrix,NOT_FOUND,"Filtering and “cleaning” data by reviewing reports, data files, and performance indicators to expose and plan corrections to code or data problems....",NOT_FOUND,https://www.indeed.com/pagead/clk?mo=r&ad=-6NYlbfkN0AkmEfxfIvywYkr7FPgbbzZtS80TzOGC0Qwk8jq8kfwxcmRMEv4cXPur2iIiy6S-b2A9S63iQ6y273o04DbbDa8DGeXjpHpilpYvUecdh3-r0EnPObskLpHWJaFb7yLqEv7kpqw5OGXyhjkdQmikH0IRxmmX4wAFQnEaJktA_7GeljQ2vQsGcwYGo6vqnQOMjOCYnkR6zio1nT-PQbXcdV26CHDX_RNK8fPTaZFgsgeb25eFxBs9ehm-vkxw1BHDHf4w9UKQei-zGHoKfnZf1WJxPDYA64-p4z17z62o_pVghF2EGv4dOk2p3JZLUzZSrMND2tn-n3o-Gugv01ixkmd0MKxbFZFREnwVRJRGZLv3XxsBFaRQQbfFLETAR3pQgmZ-YNy9ikioa96OkhEXVCPYPAugoa_B7oB1F5YR56ByvEbcbfQtWVS&p=15&fvj=1&vjs=3,3 days ago
449,pj_2ed4269ec24c5a71,Boston,data+analyst,Space Planning Analyst,SAS Retail Services,NOT_FOUND,"We’re looking for Planning Analysts to join our growing team! You’ll learn about consumer insights and how you can use them, along with market data, to meet...",NOT_FOUND,https://www.indeed.com/pagead/clk?mo=r&ad=-6NYlbfkN0D32AtJmRARqp3mPvj2wcN4e_HwHaBMPLToiD5CY_lcraBuK3NPtewIv7Npyc7l_18vb1u4YKklMGm5hp4axQCVHkc6jydTiP2lMu4bPjj096CXorNA7ylyNFGsf-kuyf_5C3RO2i2DT1Z9CEtz0O2bc8DYH1a3F9-Vn8B0xbmWWdQZ6vH9WG71H89tJVyrmztr-FZ6Od-vAN1VGItCLwDBSHgcRW6GAw3YdYuJkme6g5SmGuziXBMX-HmvMmKeYCzHQ0fUaF-ijrsawQTT4xOoQRIbgj_fhjgSsmDvh_RdgG3mK9L3sEtFK3vFfxdoauSlXSS-WoR3JCp_xUHDBHxibjzMicCP9M9BsXaM2HwvYnFy2eWpuVlYD5474j6FOd8vxoe8SLnLWzkWWS8tfd3RXOTO6KcH2yxd3HwkIcbAE-lcQKD72v6T&p=16&fvj=1&vjs=3,NOT_FOUND
450,pj_5164f499ca3cbbaf,Boston,data+analyst,Data Analyst,Forward Financing,NOT_FOUND,"As a Data Analyst, you will play an important role in harnessing the Company’s data and analytics to provide valuable insight and analysis that will be used to...",NOT_FOUND,https://www.indeed.com/pagead/clk?mo=r&ad=-6NYlbfkN0CuoFyY3--MdiSzQkIQ3K4ehh0zNtndF9kZFlmc8DmBu-iBShQlMAFb2W7hWrEbC_Wu1VGsSmzxHfAGolcO8QK0TuJeYXMOqWCbLcZ93woKc09ws5uNpTlODrDEauk3Isx1FtHmugwULbhhMrlYK3qAYVkNPcpQyLlLI_VwQxu8P9WWlXUfS0LfsCoV1MLp7OZHVDHOjpG0Adg6i1wUp8SLWDdTHqV5WKJ30r0-X7Wzj65nEMvQ6cC7k0O891HRaMOBURqCxGg7vTO9dDiuHhPYvmHkWIBC0bj_y_XkZo9Nd07KnUN-3PGy_RxOAGm9nSH5MTq1i_GNPkDa8vh92T7nQeENmiT0bUYBAIQl-TaY7eTPj3sZJv8TCnWqTWVvjZaDk1Pdk3rffz2AtCpD5gyQIK-rGd10e_UDcsTB9nr0mJQykip_GpCF3hfeF75HMFuoVHFws0Mkvi0kTYap5EVcWwOtiIPKZUit4JB0xPfclnqKI-9TtlgcFQ8QnZb6ikY=&p=17&fvj=0&vjs=3,NOT_FOUND
451,pj_dc6afd9175b203fa,Boston,data+analyst,Royalty Analyst,Hachette Book Group,NOT_FOUND,"Validate monthly financial data for month-end general ledger reporting. Excellent organizational skills with the ability to multi-task, prioritize and manage...",NOT_FOUND,https://www.indeed.com/pagead/clk?mo=r&ad=-6NYlbfkN0DL68TXyauRvgJshQFvl0CXX9IUYxuQWsknLS_AKZyJ1tTw4-HnBztNCt23CVimEqwICvoZJFsQhLAIYj6MhI3WnMYTRKwsypUW1W_RXEFQEFo8pLbTS86VATTDSpB-Dn_3QdXm5QeqHFbVEdn0N8s9U_sgb9h4OvRAO0gg1U7xeVGw7NW6JMHA5GG7LoheBUu6lejlDUXMY1eI9uGpQcZdnaHzJuihSFTHi_6llfVwnFXQFMsafZ0hD5O2s78N424D5g1AtCKqV5A8ui4emz5gfZ8qMAEJrvSz1sbQFCw9V2mXCUQQjun6-HFUYhbj3ga5X0tikAegYXxRi9LuvGRu1a5ca6JxwYFddbEZPdoAaJm0jYnVoa8cihOdwZzMSXbVzXSozlPJJTiAT9jT8ArD9-xLRpJcikqUrTEOyA424tdA8nn-43KqVpNwp4GgQJHveWAkfc-PUPJLxTbO-1Dtqpt9Ke3o7SNOYgRthwitNrqYI8SGY6QFiDit_ftLmrGA_w5cLdhRubdR7J2Y1JVa&p=18&fvj=0&vjs=3,NOT_FOUND
452,p_b340c55ab27852a7,Boston,data+analyst,"Data Analyst, Market Performance and Strategy, Analytics",Criteo,"Boston, MA 02109 (Central area)",A passion for discovering solutions hidden in large data sets and working with stakeholders to improve business outcomes. Who we are....,NOT_FOUND,https://www.indeed.com/rc/clk?jk=b340c55ab27852a7&fccid=d3ee4a7355a0fb60&vjs=3,30+ days ago
453,p_9ee95bd6d4021091,Boston,data+analyst,Sales Operations Analyst,CarGurus,"Cambridge, MA 02138 (West Cambridge area)","Analyze inbound account creation to ensure data integrity, appropriate hierarchical structure, and book of business routing....",NOT_FOUND,https://www.indeed.com/rc/clk?jk=9ee95bd6d4021091&fccid=e631af507c24575a&vjs=3,5 days ago
454,p_a50fb6ccab3105de,Boston,data+analyst,"Data Scientist, Imagery",Indigo,"Boston, MA",Build deep understanding of existing algorithms and imaging data assets. Can work with and understand a wide range of geospatial data formats....,"

                                    Similar jobs on Indeed pay $99,000 - $146,000 a year
",https://www.indeed.com/rc/clk?jk=a50fb6ccab3105de&fccid=27b70883756a2db2&vjs=3,30+ days ago
455,p_8fd6427d66381d54,Boston,data+analyst,Planning Analyst,Wayfair,"Boston, MA","Senior Analyst, Inventory Planning Strategy. Support initiatives to drive improvements in the Inventory Planning systems, data, and processes....",NOT_FOUND,https://www.indeed.com/rc/clk?jk=8fd6427d66381d54&fccid=95485c6456ed2114&vjs=3,28 days ago
456,p_da610d2882def20d,Boston,data+analyst,Data Analyst,Lynn Community Health Center,"Lynn, MA",Acquire data from primary or secondary data sources and maintain databases/data systems. Decision Support and Data Analytics....,NOT_FOUND,https://www.indeed.com/rc/clk?jk=da610d2882def20d&fccid=bd357d42451eefc1&vjs=3,30+ days ago
457,p_fe5027e04d0757df,Boston,data+analyst,Data Scientist,Localytics,"Boston, MA","To manipulate data. 3-5 years of experience as a Data Scientist or Machine Learning Engineer. Develop algorithms, data modeling framework, and approaches that...","

                                    Similar jobs on Indeed pay $108,000 - $159,000 a year
",https://www.indeed.com/rc/clk?jk=fe5027e04d0757df&fccid=4ddbc06e22ec3870&vjs=3,30+ days ago
458,p_6cbdb5b73c6ccb5d,Boston,data+analyst,Research Analyst,Burning Glass Technologies,"Boston, MA 02109 (Central area)","Running specified queries using Burning Glass's proprietary labor market database and other published data sources, preparing data for presentation, and...",NOT_FOUND,https://www.indeed.com/rc/clk?jk=6cbdb5b73c6ccb5d&fccid=d7437cae23e0f81b&vjs=3,30+ days ago
459,p_a24b09682fd02ddd,Boston,data+analyst,Systems Analyst II - Path to Green Unstructured Data,MLWIZ Team,"Boston, MA",A. Domain Knowledge Needed: Nice to have someone with BFSI and openshares background B. Technical Skills Required: Experience working in infrastructure...,NOT_FOUND,https://www.indeed.com/rc/clk?jk=a24b09682fd02ddd&fccid=3b4511e7fb94c511&vjs=3,30+ days ago
460,p_98514465d81c4f0c,Boston,data+analyst,Data Analyst,Berkshire Grey,"Lexington, MA 02421","Proven working experience as a data analyst or business data analyst. Data Analysts are responsible for interpreting operational data, analyzing results using...",NOT_FOUND,https://www.indeed.com/rc/clk?jk=98514465d81c4f0c&fccid=30dec79f5d31bd64&vjs=3,30+ days ago
461,p_7bb59f0d4ac9f6fc,Boston,data+analyst,Cash Collection Research Analyst,Partners HealthCare(PHS),"Somerville, MA 02145","The Cash/Remittance Research Analyst is responsible for the daily maintenance, reconciliation, analysis, troubleshooting, and reporting of Unidentified Cash....","

                                    Similar jobs on Indeed pay $17 - $25 an hour
",https://www.indeed.com/rc/clk?jk=7bb59f0d4ac9f6fc&fccid=26ed24f5b2eebd9b&vjs=3,27 days ago
462,pj_9e5a1caef45f8609,Boston,data+analyst,Leader of Foundational Data Architecture,Wayfair,NOT_FOUND,"Lead several teams to develop core data assets used by data professionals across the company, including hundreds of data scientists and thousands of analysts....",NOT_FOUND,https://www.indeed.com/pagead/clk?mo=r&ad=-6NYlbfkN0BWKOYaUJfzlpbj8B4EVHsr8Rk3do3CBb7WzQD7M0cgO4MmQYBeubwD0nUaCahAaLiFiR7VY9juaicvsEnHjx5S9LMP7j1i8TBevWVfLZuuDdWZS4PDEwHDQlQn7ESmsQX6RIrZ6QM7--0K7Rn4aWr-olauQ-VNb7ngP7pv7QcU2kM8U1G6pYJPUiyH0Z91kiAtayhneb8jNmNpNCgfqS494h9iJGjslDuBiuUecncPLMzaxyIHu2aaXXjClNP_2HqnvGwzw2vVxVgv8DBu3Ikf9r-WKOH6SCkHJqrnSb-FLHizLV3C22aP2tPg0H8mp7LHmAd5CHRN9Vvi65jYS0vvz5nNph_RzFzO6VxOtBIFguA5gqCNEA1TNS2w1g62goK5CoyhKGIP65wxswkmLlyIEHCwGwODCxASIcC5tgthvExSSqsWYrS88kf9IrybkzoF73oylDLhKNmV4e4xEjMdvPqzijbc9l004lq69kTIm3WLEe646-_0rpj0nfQboHLhq6KjePFSsg41QMSands28RYbx-pzLOP_NEW-cCRjo2KCogB4Ch-rH5V2hwhhW-I=&p=10&fvj=0&vjs=3,1 day ago
463,pj_2ed4269ec24c5a71,Boston,data+analyst,Space Planning Analyst,SAS Retail Services,NOT_FOUND,"We’re looking for Planning Analysts to join our growing team! You’ll learn about consumer insights and how you can use them, along with market data, to meet...",NOT_FOUND,https://www.indeed.com/pagead/clk?mo=r&ad=-6NYlbfkN0D32AtJmRARqp3mPvj2wcN4e_HwHaBMPLToiD5CY_lcraBuK3NPtewIv7Npyc7l_18vb1u4YKklMGm5hp4axQCVHkc6jydTiP2lMu4bPjj096CXorNA7ylyNFGsf-kuyf_5C3RO2i2DT1Z9CEtz0O2bc8DYH1a3F98R4FqswXYN0aP9Mzq6_IwLpyNjT6AyriXsV4seoc4kE_70P6TWjk_-qtn2NswrCijJjEbBWB8VNhAPEP499Qo0Zrmjyeuy-Xo7S-Bd39XMSJjGK7WGSwy_MJnJSPdAtoHXqDxWvRq2A_ZvjU0lzS_ZsJREUHIcXC9QdUEZ6u5-Fi9_p1Eu-nLEqbiijt5E98D2l6-pHoPtLCXl2HKGOErYtHP0JgRtobneAz9ZASnIs-m3XL2F4qR6-MIVF-iT7GsP6L_8TS6iX-KvsTGqL-25&p=11&fvj=1&vjs=3,NOT_FOUND
464,pj_fb355b19441bb448,Boston,data+analyst,Data Analyst,Indeed Prime,NOT_FOUND,Indeed Prime is a free service that connects qualified job-seekers (that's you) with top companies hiring tech roles. With one application you can be...,NOT_FOUND,https://www.indeed.com/pagead/clk?mo=r&ad=-6NYlbfkN0DhVAxkc_TxySVbUOs6bxWYWOfhmDTNcVTjFFBAY1FXZ-EFN3cXsFacyjbJwnCPXT8pu1IIVxX8o1IMegaEPUNeN__Uobs3YB_VokyltCmkQgRUrRBaM9GC98GdKvjsqlKlqNvKR7vn6vt_wmUifQWom9XQf33YvJlTpnt0mQBq--lDHgJ5Mom1X7UAEOB-MR3DkBH521G-lmEa5HwJ8dvoyqBxVzkqwP_3Y9ei8u05pZgAINRlplkqADw0qfOqjahiYuLUTeFWXKETif57tEzEyXdj6YS7_6-pC2wBbrCYWdiq17ydKMvbrO82dI3-IhleC3ohHYl4D8sQDx4p7OVeF7eTfT3HAyTIXYDx4wHL9r4tQb-9ZRMj6noq4qnrDFY9vScyZhyS0P-qrUUv0IZIaO7Ie_5G6tNhJCEhDr9gonZ61FLpC0eVoVCC3e6g3VPo5QZpiq51O33puJ6dfAOLEaBkR3W5LTUn3tAd5jfhMOLGweGt654giSqwlRUDuz2QvPXnxgbSgK8WOfs6UnCWTAztuSHPLRrJIa9kq8Fq3g==&p=12&fvj=1&vjs=3,NOT_FOUND
465,pj_40dc319e3f59a43c,Boston,data+analyst,"Jr. Analyst, Shared Services Department","Aquanima, a Santander Company",NOT_FOUND,"Junior Analyst, Shared Services Department*. Enters expense request data into the applicable systems and ensure ongoing data updates occur with the highest...","
                $26.44 an hour",https://www.indeed.com/pagead/clk?mo=r&ad=-6NYlbfkN0APNbLdfjGTZQ6Xx9E3aLBpyi0c9QrsRnjOm4F-aHjG0XkYJ1eDZ6KHi9VwFnnWipXqlkXINOMDNGQjRxOvPYiutTexGG9fSQ188EME_zQWqqR8oLXRQsHjBUkdZdD8oPRfCPRd04hNT2yEA-UaAMwvabKEkVYEGE77i5DhScF7DEPMy34mViOU_t7K3i59KsnmWYfDKA3CJQJeaiMJA9r2SrQab0Ji1qqmxmSZgc_05gHL4qmvOV_Vg9IW1zazm62ocuflA2eYiQrMU0NBQBSXfsyCVWsK9_UAeIbIlyixEYvXbkYLnDm592sZzr4mbbmUM4y62LDMk5pw4r7g2x3Y-nhOOY_67Ubn8qT1a_bChYbALoMe6Y3ycyNiOxDrnTV9CdU624Is-UyH-GaXX_Rjfckq1iWAfvbL8TPsAkbavafYKK9zrOzv_Ix4ujwWEb6lABhXCtFxVA==&p=13&fvj=1&vjs=3,NOT_FOUND
466,pj_1574ccd1f59001a0,Boston,data+analyst,QI Analyst,Beth Israel Deaconess Medical Center,NOT_FOUND,Collects data and prepares reports required by defined internal/external specifications for performance measures....,NOT_FOUND,https://www.indeed.com/pagead/clk?mo=r&ad=-6NYlbfkN0Dw03TYZ1DoEpSmrIdQV9CyZfFP5XfcEA155ZR656gis26NsKsa_Hmi0rDUpeIM-HT1kNN3ivfENypr2qHj9DSn4ml_M8EfKrqwL5BEFkjuxw1b-TOH7p3zjNVOfwYRp_S5LSrUNOxVEah7HN9NqS0BnzXaq3LrUigxwfts2KnoMY6hHzdB-2hZD7P2xWYYGlTgzoyHa9OAyAzqfiPvHwS9PLVl51i8xN8ovwGCA1bo42KDMoRWuEv7BKRynD_-l1Zu5C3B9ckB6wG_RataC-En_1t_l7ZUOESq2jJ5pSQCi-ZN3m3UuWhfYjyVPglB-s1he6v2Ztv3WDfGblAhB3_W5YFnmeSbg04KeIRo5W-Q8MTMqPWN8oKillI2wVgyUUC2xfafog_c9m5gdK5FpVCu31K1Lbj5Uc3Uoi3gdsID6AZkCOEFK4-ZKzGc8_4FD1sUUnxPpe_0uiEYnRegBujC5ONGV-CmnAPTtNKgrCqUW4rn--RBxtxZVG9IAu1NGaAAMLzJZzJScKcGy4iCdVk8PqgHiNU7i4chsR0PeYpnEabHGLcGA_EV66g0CNeMO_F_Sl8Fozso3gzBmDmyPt-4O3MOQ1KgEwbvKTWbxek7pzUb6KzjbIIMXFoCzMAcRvvyfxVG1VfdwLLee99UYmfONTPxAFGcdPCA05xg35u_o2B16ibyLRZyj4Islu3K6oOyAg5OWOsmzkWwYmM2DOh-lltUgHodFq6ICA4jb_yXX-o_c4VlD_FdiwNbwfgep5yBqEa1xEWc5pUY6jcbv7VJEVZ_-VsCfjcY6NQdpnptPQ5c6VkzEnYpkFhevJjJEO55r_0c2b0LR9rgS4mnw6muJeXr-UgSheyNPae-2-qxS9a4CeAQRsqZkx8hjd4Lho9XTv8KFzqL1xQtbyjuRxTj8uzXUgaD4tpcMlHu54HXY3lE1H3X2-lqVopjlm2hoYw=&p=14&fvj=0&vjs=3,NOT_FOUND
467,pj_37976f5481a32076,Boston,data+analyst,Data Analyst II,CodaMetrix,NOT_FOUND,"Filtering and “cleaning” data by reviewing reports, data files, and performance indicators to expose and plan corrections to code or data problems....",NOT_FOUND,https://www.indeed.com/pagead/clk?mo=r&ad=-6NYlbfkN0AkmEfxfIvywYkr7FPgbbzZtS80TzOGC0Qwk8jq8kfwxcmRMEv4cXPur2iIiy6S-b2A9S63iQ6y273o04DbbDa8DGeXjpHpilpYvUecdh3-r0EnPObskLpHWJaFb7yLqEv7kpqw5OGXyhjkdQmikH0IRxmmX4wAFQnL6alLZUPh4pQJBePgOCJ-YOmfk1C3dGxmCV1HK4d433H31CE_tZR_3WXEmKN71p6a7cOV5kPc_RUhyXChUwmGQHZy75ZRxvNnDzO6gAYrbZKDiMnLc6Vzp8RqK2wbKFZIKKeZGF1ArBWbcqA3AsFn4_S-RC2REHwJkgExhqqc5AP8i4_XQLD3MQaKfs7Dq4n374mEy3ncqJvZTslz_O_OWJQVgczEpr7SrlkGKo19WtDWqM7go-146ihi9Blsql-INQE3lTWmG4mmJZxi8mYo&p=15&fvj=1&vjs=3,3 days ago
468,pj_712a395f5bbb04b8,Boston,data+analyst,QA Data Analyst,HP HOOD,NOT_FOUND,QA Data Analyst - HP Hood. Presents numerical data effectively. Publish data trend analysis reports. Work with department directors to assure data accuracy ....,NOT_FOUND,https://www.indeed.com/pagead/clk?mo=r&ad=-6NYlbfkN0CybCVwhmkLTCIiqD1-ZFQUpj9tFoSiLejrbuvZUvGjhYWHpqHXQ_ylJ37Z_W_bsjcrwm3pRzBKIr8HUuT_KYdfwqQtpd1STWfyyTjtu9tnEEcYONzp-E4RKkCLc4GeCqTyRepGzv_wrlJz-qt8UOhnc23j-CDaVfqrVxlxEaUb9e61TWa8Q4PzcjCpI1dC7y_-TZ3iiD0y-m22dqWuuBmiLLbfFpX6QJxY-T0XkZ3N_sSMcZp0wnq8fGRW0CTcbBbfl6Btz9tVTEArqw-PKA_O_nrgvc5Kh-3UL8MCRXOBt0jGIN7KtrgsSU658IRgQiBQXiropw0vB8cIU3YNTHrTaerVJ99Tw3CywGWNnb5WtJ6OC0d6WzAa3OjaeyL5YJVB3hVez3Tyx1PaEwgXTuFI0eXCuOvGGMP1SfHBLQcE45yzlN8TzKF3&p=16&fvj=1&vjs=3,1 day ago
469,pj_5164f499ca3cbbaf,Boston,data+analyst,Data Analyst,Forward Financing,NOT_FOUND,"As a Data Analyst, you will play an important role in harnessing the Company’s data and analytics to provide valuable insight and analysis that will be used to...",NOT_FOUND,https://www.indeed.com/pagead/clk?mo=r&ad=-6NYlbfkN0CuoFyY3--MdiSzQkIQ3K4ehh0zNtndF9kZFlmc8DmBu-iBShQlMAFb2W7hWrEbC_Wu1VGsSmzxHfAGolcO8QK0TuJeYXMOqWCbLcZ93woKc09ws5uNpTlODrDEauk3Isx1FtHmugwULbhhMrlYK3qAaHdYMWGuVRbdDXWs0TvjwlKsER_lJodvxDrkT6HqDZkXqKcbg4w26xgg3iB6Jdeq0mqs_m6lNESwembzcJPp3XPup6KC8Z_HL_dMnPTN9_39s0rCE4Ig65V48WIaTSj82d39dxS0Qor-ZXYl2wXW31TFIGHlYaBgAZrp-kAMEi3ip4UU1HmUWmLYnoegOvt7xm51yuuuhy17BijO8mcd_RsBlVrWhSQmGrm9r2xvB4arJGxqqV2UU_7txznCbi6bkAJdRVP6VasWj2TBjZYc0F1JIce1qGkTNIUV20K0rjGuPx-A0BfJjY_WofXOrznQ0vtKeD_eVJtFvuQdD5_faKYDZb9u95K0a40JCA9Aqys=&p=17&fvj=0&vjs=3,NOT_FOUND
470,pj_5c24193f260981da,Boston,data+analyst,Health Data Analyst III,BMC HealthNet Plan,NOT_FOUND,3+ years of experience as a medical economics analyst or health data analyst in managed care / insurance industry. Serves as data expert for department....,NOT_FOUND,https://www.indeed.com/pagead/clk?mo=r&ad=-6NYlbfkN0ARNDy9qX-ZLaFI5nphG4ZmPAPbgk81hoWjOObf_Td8g2BfUQgCr94H4M1tF0WAKcQk4QhhBnYXluR61Pn5kLyBwFz48GwU9mYyuC2m8PsCQR5SwiUbWRPGeJbM946izYXn5LBqcIdCMeO1HwdORv5lIOAg6RY49O44jQTiptmuEN_HWMypNa2ALm4Q5LttcnTIIGcW5U7NdBWg5qKMv7GlB2WE9qeMQ4_LP0jGjVcLgO7oznLppMP-D_vaUWegVb3407dd4xGD-4zlfsUiYprTrJwFAfYJCzCTneKj72r-6VIOEmZRBR12TFXEaNQv4dsUN5Dfl360NRB7QitOkw-dqzqU4L9vGZywxfDufR46C6TlYNFeAkRqHaOLDU9NnE-6t9nfZBZbn8blp1XqJYfgQjIsdImqSmZfXWr2_iWD8AiMTdHdq8nR813713PmySYx8AszaHSXrjtDgCQ8z96bPOQNWZgUTzSsusVbsnW1kQuiKTNhPwt8i3qJwfOUEmclIlZixlIYPeZRfAbBIwzUo59aKhazGzdPGDOok4WjqO68K-wLHQnumm7ZIJaz5XLLN3hx5Mg6T7Tio41ZkHtFm_ELsjzpJDZucjQ1uwAcNT6D5b6C2YNkQX3eU3aPHcJ-LqkhHj1phI_vrAjbZ58bn4oVBTctGgsfqCWFqQQt6g==&p=18&fvj=0&vjs=3,NOT_FOUND
471,p_7ca5f7aa39dc2ee3,Boston,data+analyst,"Business Process Analyst, Operations",Harvard University,"Cambridge, MA","Harvard offers 3 (union roles) - 4 (exempt) weeks paid vacation, a paid holiday break between Christmas and New Year’s Day, 12 paid sick days, 11.5 paid...",NOT_FOUND,https://www.indeed.com/rc/clk?jk=7ca5f7aa39dc2ee3&fccid=5507a64404691526&vjs=3,30+ days ago
472,pj_ed1748f84c16d8d8,Boston,data+analyst,Business Analyst,Harvard Bioscience,NOT_FOUND,A minimum of 2 to 5 Years in a Business Analyst role. 3 years (Preferred). Harvard Bioscience is a global leader in the manufacture and distribution of...,"
                $78,000 - $92,000 a year",https://www.indeed.com/pagead/clk?mo=r&ad=-6NYlbfkN0AAnqrxq6bbXU3S6BAl_JIGwtxuPyH0w42DsqVE3UGdM1YnETsEr67SquI2DDVnrSMwWHiH9kZT4Z24E5Srn7hhKlsYeJYi0p_anTw0Sf-72s7UEae6qsBOwdgTpewv8efqeFPPDBahvf6b5_ocuN7jZ6VfoLl8Fg8EPFTod3OE3vbzGhTZj1-ygyPIb7IOJ-3Y1d9AFZcaFCqKNYN2AD2fyWnhXf8vYWGvOL0motUYbxvtbEk7J-egy0L3k1ra0f3DlE2FKpFhlZFmeI_N5suJ3oxzLIBN9uA-X5xEYhOWKz7Q8c9RZNQQRDifovQFRGBBOWM81ekYHdcZiE0hLWsxubSWMQjkCuTUOAAyEYqR4nea1EftQOYg6bo3AwiJ_LY=&p=1&fvj=1&vjs=3,NOT_FOUND
473,p_dd6fcc4aa94e99f9,Boston,data+analyst,"Data Analytics, Senior Consultant - Managed Analytics",Deloitte,"Boston, MA 02116 (South End area)","We support the operations and enhancement of traditional data warehouses and next generation data lakes, along with their related applications and platforms,...",NOT_FOUND,https://www.indeed.com/rc/clk?jk=dd6fcc4aa94e99f9&fccid=9e215d88a6b33622&vjs=3,14 days ago
474,p_22b21bff7a20356b,Boston,data+analyst,Technical Business Analyst,Brightcove,"Boston, MA","If you are smart, highly motivated, and detail oriented with a polished communication style, this role at Brightcove presents a challenging and exciting next...",NOT_FOUND,https://www.indeed.com/rc/clk?jk=22b21bff7a20356b&fccid=2d526a795fbd0182&vjs=3,16 days ago
475,p_331284b86d47fad7,Boston,data+analyst,"Lead Analyst, Global Business Change- Business Analyst, Client Implementation",BNY Mellon,"Everett, MA","Delivers and implements small Global Business Change projects initiated by, or related to, external clients through the provision of project management and/or...",NOT_FOUND,https://www.indeed.com/rc/clk?jk=331284b86d47fad7&fccid=b4048be2884af072&vjs=3,30+ days ago
476,p_91eb5e5cf391ef76,Boston,data+analyst,Data Systems Business Analyst II,Health Management Systems,"Danvers, MA",Ability to be careful and thorough about detail. HMS makes the healthcare system work better for everyone....,NOT_FOUND,https://www.indeed.com/company/Health-Management-Systems/jobs/Data-System-Business-Analyst-91eb5e5cf391ef76?fccid=53e12f2f7fcf023d&vjs=3,10 days ago
477,p_27d31a00c21bea89,Boston,data+analyst,Data Governance Analyst,Trianz,"Boston, MA","Job Description Job Title: Data Governance Analyst Location: Manchester, NH Terms: Full-time or Contract About Trianz Trianz is a global professional...",NOT_FOUND,https://www.indeed.com/rc/clk?jk=27d31a00c21bea89&fccid=65a841a7f945806c&vjs=3,30 days ago
478,p_836797044f52bfee,Boston,data+analyst,Business Intelligence Consultant,Mavenlink,"Boston, MA",The Team: Today’s leading companies are able to transform their data into insights and strategic decisions that drive growth. The Business Intelligence team...,NOT_FOUND,https://www.indeed.com/rc/clk?jk=836797044f52bfee&fccid=aafc821b9ac10919&vjs=3,13 days ago
479,p_c7507b94ebd0943c,Boston,data+analyst,BIOINFORMATICS ANALYST / 40 HRS / DAY / BWH GENETICS,Brigham & Women's Hospital(BWH),"Boston, MA 02115 (Fenway-Kenmore area)","The Cassa Lab and Sherwood Lab at Brigham & Women’s Hospital and Harvard Medical School invite applicants for the position of bioinformatics analyst, working...",NOT_FOUND,https://www.indeed.com/rc/clk?jk=c7507b94ebd0943c&fccid=053c0caee91baa24&vjs=3,27 days ago
480,p_2026ebeeedf6a582,Boston,data+analyst,"Business Analyst, Market Performance and Strategy",Criteo,"Boston, MA 02109 (Central area)","Who we are At Criteo, we are building the advertising platform of choice for the open Internet, an ecosystem that favors neutrality, transparency and...",NOT_FOUND,https://www.indeed.com/rc/clk?jk=2026ebeeedf6a582&fccid=d3ee4a7355a0fb60&vjs=3,22 days ago
481,pj_6dc2452979626c70,Boston,data+analyst,Medical Economics Data Analyst,Commonwealth Care Alliance,NOT_FOUND,Strong organizational skills and attention to detail. The Actuarial Services Department makes extensive use of SAS and SQL programs to produce the data and...,NOT_FOUND,https://www.indeed.com/pagead/clk?mo=r&ad=-6NYlbfkN0AvPKJZYie4hMaqdKsGd0vZzY7dSsPLmlqcV6s58mlFZOvCRWW_jxi69njVRGxlsVUn0SwKI2eBQVqKXpxFZ8tBss3XAGxaZJc9iEW3a0oHTa2Llo2DtSgHiZ_E0_58wTYN9DXOYH9bRvxRI5wLMDQQ-dpbueHFwrnQQcJldI6SW_5T6qrjYtba4Qu1R_Q5nNPI0wpu7Dswb7kovskA3Bpl-1oXIHZtAm4_pq3_KFcDWB74iwX7dE1wQs-8WRzhYZdivdcHGKm0jfygqtr6cSkAIh3LkTRjHeAjWdGTTG8UaPXu50tL8UanmP4nxWsa8fTqUR027KgpjdbV6lKbUttaH_16P6oZK7gudhOPvKIEiEe0H4uNt0fDc2c_9ho1dHzQuSjYcOl3NfyHbP9Dx3zVY5sLwbBaO5DPAzlMghwCGemyqG_46DsGnwRCyhM3VdLBKv3W2OewUFIZewPVPWfkKy0v28f125G92jsdc_wbcA==&p=10&fvj=0&vjs=3,NOT_FOUND
482,pj_8a0ffd1df6681d0a,Boston,data+analyst,Revenue & Data Analyst,Steward Medical Group,NOT_FOUND,"*Revenue & Data Analyst Steward Medical Group, Watertown, MA  Description: * Under the direction of the Senior Manager and Manager of Revenue and...",NOT_FOUND,https://www.indeed.com/pagead/clk?mo=r&ad=-6NYlbfkN0DYStt7Ah9sZ3MnZxb1fSySc7JQuMs53v1Tguu3ilSPeTClDyr0eUuHXR-vw0IY3DhMUxejA-aG0eMlkRdEfJYvEt3XLH4qwdzwnOD1DWlnkMllgb30MpjqAWBJH0Xcnzd5LGOM0_fJOhK5VbjOrJwwTQxBB7V3lciLowpyNH3NGx0zotuyyoCrTxLCTYjzMuLTLiKroFscNPLBvuB_wRWJowqB0e8aFutF345WlqEhzEW4M9yXCbV4_rW3BM5yax9b-U1bNPUMlACxngVDmNNKDQjoXonQ8VRCuZF9WitqLohnxofg1o3qdJ-stETG-8AuKcoAvl7AN-LwQpA_Hn7Ci87FhtpvXJF5xPQ-QyIlXuLk-HWRRmoIGJnuh3Ly5g5lNe6tdQcqP0fxpqIeG-Jg0oTMT2EE6Q_9Fw-M9SqrWhNdPAA0F1TT&p=11&fvj=1&vjs=3,NOT_FOUND
483,pj_712a395f5bbb04b8,Boston,data+analyst,QA Data Analyst,HP HOOD,NOT_FOUND,"QA Data Analyst - HP Hood Are you a self-driven person looking to advance your career as a high-impact player on a team? If so, we have an exciting challenge...",NOT_FOUND,https://www.indeed.com/pagead/clk?mo=r&ad=-6NYlbfkN0CybCVwhmkLTCIiqD1-ZFQUpj9tFoSiLejrbuvZUvGjhYWHpqHXQ_ylJ37Z_W_bsjcrwm3pRzBKIr8HUuT_KYdfwqQtpd1STWfyyTjtu9tnEEcYONzp-E4RKkCLc4GeCqTyRepGzv_wrlJz-qt8UOhnO9w9A_AR505aABUq78-nmTbnibW30lgTwAfra-uh67ZiS7HOHH1SMhBzLwvUUGLLTgJX2Tdy2sqALIKQSNN1q-mba3h_4OWdnuOqu-03WsGlWVWBzcWQxiytJd5Z65rCjKj8fmUTfO8GPsz5GFdue0hCsSNad7FdaFyVjOqqQYqZdTHduKFm8Tz-S-sh00O2ijq-lzIL5eanJij7hcWEDZS_KlRU6DX4UkeDSQdXhlGH_7jvB5-gx2ckd0mOcmKo_SsBUlErGYwIbuGOBEl75LoFBcjLR19U&p=12&fvj=1&vjs=3,1 day ago
484,pj_5164f499ca3cbbaf,Boston,data+analyst,Data Analyst,Forward Financing,NOT_FOUND,"This is a terrific opportunity for a highly self-motivated individual to join our team. At Forward Financing, our mission is to be the leading provider of...",NOT_FOUND,https://www.indeed.com/pagead/clk?mo=r&ad=-6NYlbfkN0CuoFyY3--MdiSzQkIQ3K4ehh0zNtndF9kZFlmc8DmBu-iBShQlMAFb2W7hWrEbC_Wu1VGsSmzxHfAGolcO8QK0TuJeYXMOqWCbLcZ93woKc09ws5uNpTlODrDEauk3Isx1FtHmugwULbhhMrlYK3qA-drLmsBA_eJ39r5PwZjdYkh4U21spWty4CtlXiWmgKjVWaTARDESBZvp0Gj6wls5jymI0QxVD-F8f4nWr2wTEbe9mSU-EW6gx-O071g5teon3cwF3nQ4iIGNDH5YnAwtPuV2tgdv9G7bJKpF4G_yQn2UiNLjcMhR16DDj8rFNZmFw_PPogeDysz8AwYT0DTqeqVuaftQWyonS1UOAiGQLX4SV6Y12twdT4yR4G9X9SxEbcdrFGg51QcIwWMwIpCk982cowUoOfItrhr5b3Pkt1msqieiJ9Mk4q99jq3tCRJSw8K9VBe9z_eaZp1B1epamRK4pPNj0tP4j8DGtLw_5anXe1WPIl6dPjbOOJvAoZk=&p=13&fvj=0&vjs=3,NOT_FOUND
485,pj_fb355b19441bb448,Boston,data+analyst,Data Analyst,Indeed Prime,NOT_FOUND,Indeed Prime is a free service that connects qualified job-seekers (that's you) with top companies hiring tech roles. With one application you can be...,NOT_FOUND,https://www.indeed.com/pagead/clk?mo=r&ad=-6NYlbfkN0DhVAxkc_TxySVbUOs6bxWYWOfhmDTNcVTjFFBAY1FXZ-EFN3cXsFacyjbJwnCPXT8pu1IIVxX8o1IMegaEPUNeN__Uobs3YB_VokyltCmkQgRUrRBaM9GC98GdKvjsqlKlqNvKR7vn6vt_wmUifQWo-i2aKsuyhNkKUNfXlxGeFqkuM_FCz6V4LLdklb6_ZzK0XAh7rIhkj1fKAgqo-ABwx6IxMBUUYSOH1SJBsxJ4EaCsrGIZHGm0Ht5cI_vSnqaQaSx7joc31mI5On6C_BPDY-mYem9K3owvX2oMyFA36cr0Z--pW8GOKnaqBfIPQiTUJ5tO0Wo4jsEt-mMCMUrIXZJH5pcS5CbqS8reMyzcwJ8dOl34YZqCZ-VL5ZIsAHDKpTOk7lssfb3oQ9gXqxmvtZ8e548PrLUKVvTz5hqNmhilGxp0zhZsLWuto-CnOt6xFtlyN0EqLzjtx4AtRRkzWEhIC4VqWTuvBGEHkXLbXp8dQ-IURNDjAzXN-6beX3i21dwje5rpXKrUwbhptlqExIZCiDTle0SKMEGEaePh6w==&p=14&fvj=1&vjs=3,NOT_FOUND
486,pj_37976f5481a32076,Boston,data+analyst,Data Analyst II,CodaMetrix,NOT_FOUND,"5 years relevant experience, strongly focused on analytics; 3 years (Required). Ability to work independently and efficiently under time pressure in a fast-...",NOT_FOUND,https://www.indeed.com/pagead/clk?mo=r&ad=-6NYlbfkN0AkmEfxfIvywYkr7FPgbbzZtS80TzOGC0Qwk8jq8kfwxcmRMEv4cXPur2iIiy6S-b2A9S63iQ6y273o04DbbDa8DGeXjpHpilpYvUecdh3-r0EnPObskLpHWJaFb7yLqEv7kpqw5OGXyhjkdQmikH0IoosI6KbOOoG_5WLDcJYjq2BnlbHlsm6J7RxYEWJFJvENqLYP2ZsB6GlO4_FmwzkHuMhI9t6YTLWjB9TfSVL0NQ0jGcOWz2zuJvoDn0Dcz4PM22AKpER88Q30BwOqHSAVHRoY7US8VuK_iLhB-ChI9GQYR2imqHmvJr5ka9pGloE6GKxSHw4oifDjJj-o8osFpaJxy_teNaJbl1chW-7P9ngtKUzQqiUaAVUkVKNXQxXht59V2eUhZaygVSOlDPXRpwFyxjRTAPlviz8_-5gaStLizfb-uHSl&p=15&fvj=1&vjs=3,3 days ago
