,unique_id,city,job_qry,job_title,company_name,location,summary,salary,link,date
1,pj_5164f499ca3cbbaf,Boston,data+analyst,Data Analyst,Forward Financing,NOT_FOUND,"This is a terrific opportunity for a highly self-motivated individual to join our team. At Forward Financing, our mission is to be the leading provider of...",NOT_FOUND,https://www.indeed.com/pagead/clk?mo=r&ad=-6NYlbfkN0CuoFyY3--MdiSzQkIQ3K4ehh0zNtndF9kZFlmc8DmBu-iBShQlMAFb2W7hWrEbC_Wu1VGsSmzxHfAGolcO8QK0TuJeYXMOqWCbLcZ93woKc09ws5uNpTlODrDEauk3Isx1FtHmugwULbhhMrlYK3qAaB9YvaOgEBIGwVG6QX41oIjRtHc8MBqcuMsqqoUzI-0yBMfsfEN-pQqSdgDaae0b8Hfd4lC7r3qcL-Rm-I7p_w6y13PX2ZyJmGEhHvQo58OqqGpIgm6MjosY-FX6rKHl4h7zPeNk10DS4HkUpzNGMXDyVbAbUNaPCpBq9pLlhaDSXfRiZAdKwx82hwrcIWDPsghJ0adnbWthCDGSs_HBe23xpb5zxm76DqVNDQgnuE0Red6Iv3pFDqYaKoL7wOiIWGCqfCR4jRtFNHDfb4EIPI0WtSH8ES5LW7sMNcl_hkhrrvKbkgsNN7TyMifQmrM_o-uriVTOfJ7I00tEw-L7fQLK8UDPNBQLhjEHY-SRZFc=&p=0&fvj=0&vjs=3,NOT_FOUND
2,pj_712a395f5bbb04b8,Boston,data+analyst,QA Data Analyst,HP HOOD,NOT_FOUND,"QA Data Analyst - HP Hood Are you a self-driven person looking to advance your career as a high-impact player on a team? If so, we have an exciting challenge...",NOT_FOUND,https://www.indeed.com/pagead/clk?mo=r&ad=-6NYlbfkN0CybCVwhmkLTCIiqD1-ZFQUpj9tFoSiLejrbuvZUvGjhYWHpqHXQ_ylJ37Z_W_bsjcrwm3pRzBKIr8HUuT_KYdfwqQtpd1STWfyyTjtu9tnEEcYONzp-E4RKkCLc4GeCqTyRepGzv_wrlJz-qt8UOhnVFAb-PF7inp7xZwOrcxDWivd7HfGG8DJWq1pyM2CSljB66kYZIpIVosM0fWdbCyS7aKSxJEROgeuNF-qf27Qdab9HS0ChFu6-gKtDkMfJJcm2z5dIjehkI872GmNBEe_WStvnVSH8FeTZQgoRgxRt0zfQ1HMgcPll-Vjk0Ku93RfG-YtxYBp1p9JaXw-WNHMS0qtqJpqu6hMfkvPaJlBXE37bGN6l-2Rz-HElCmOOwVe8iM2F86k55oHM8voK2fOD7acgxf5DepscXZW1dqDnbm7WJv5GbTH&p=1&fvj=1&vjs=3,1 day ago
3,pj_6dc2452979626c70,Boston,data+analyst,Medical Economics Data Analyst,Commonwealth Care Alliance,NOT_FOUND,Strong organizational skills and attention to detail. The Actuarial Services Department makes extensive use of SAS and SQL programs to produce the data and...,NOT_FOUND,https://www.indeed.com/pagead/clk?mo=r&ad=-6NYlbfkN0AvPKJZYie4hMaqdKsGd0vZzY7dSsPLmlqcV6s58mlFZOvCRWW_jxi69njVRGxlsVUn0SwKI2eBQVqKXpxFZ8tBss3XAGxaZJc9iEW3a0oHTa2Llo2DtSgHiZ_E0_58wTYN9DXOYH9bRpn_IIW6EHM74KcldcQiXYZYukNzudV5vT6i5WX2f9BVgsA60vlxxQ7eHOiAPZkLEdHaq3bceZpU4CExe2ijXLMtnYk1fOyZbfDPghsYnPdNtNcJwmLEnz31czDjteHZ2Z0lddkm8dG_dv9wC6BrrdlXVMMSc23BDPUFx3zeaDhBx1rqjKFqZshabjZdktqpqt4fDRIDpwFBszuIyWMRh3PIITGnGczkwcW8RLknB8etFw5Tk7Xz7F8a1XnsMT-dI39P51wzAn8mcHTeVmlpyxfpvvTsUIeZiFf-zqt40tnmD8rllFudWxPmBTO89N3lHCsMuXdisnUDK9tdlhOnNR6tNQxKGIHp6A==&p=2&fvj=0&vjs=3,NOT_FOUND
4,pj_fb355b19441bb448,Boston,data+analyst,Data Analyst,Indeed Prime,NOT_FOUND,Indeed Prime is a free service that connects qualified job-seekers (that's you) with top companies hiring tech roles. With one application you can be...,NOT_FOUND,https://www.indeed.com/pagead/clk?mo=r&ad=-6NYlbfkN0DhVAxkc_TxySVbUOs6bxWYWOfhmDTNcVTjFFBAY1FXZ-EFN3cXsFacyjbJwnCPXT8pu1IIVxX8o1IMegaEPUNeN__Uobs3YB_VokyltCmkQgRUrRBaM9GC98GdKvjsqlKlqNvKR7vn6vt_wmUifQWoe2i1LefExL0ama8IpZyO5ppc3C_-Nuulw6tetjTa6whxfFOooIJKlxaBf63hnAnnVpTGmXKTpTIzw_k2LhfQhqzsHcnhEqZKJVQ3DIT0QZeTmU4sWQwSCF-LDG0chbnZk1oEu9JjLLUWSiAoY6IqEd7xf9jPI7wKPRdTbEYLuAPXTU_HQGtaw57S3k1HnWLKHAB7evjipbYaidMJKmwJt9eW3RrV-gwzZRjEtc2pHu8gCNIVW95n3k-mchoCp2IusjnY2uVnTn8eAT5NYgiNPr_LZxeVvBmV6RzBwnncUQK2SG3A8DW-Lb8MvqoMlTG5dSuQagL5QTtE110W6HclyD_rmyV6MHkhNQ2WWBNL0ajmxmx8FcV0UhnLuZtVk_OhRQPzy45-SUUu_Dq5NrKdJA==&p=3&fvj=1&vjs=3,NOT_FOUND
5,p_86e1f8e2da99c14f,Boston,data+analyst,Data Analyst,Formlabs,"Somerville, MA","When breaking new ground in an industry, you have to build the best team. Join Formlabs if you want to bring groundbreaking professional 3D printers to every...",NOT_FOUND,https://www.indeed.com/rc/clk?jk=86e1f8e2da99c14f&fccid=8e0192a48bd27a99&vjs=3,4 hours ago
6,p_348fbf7ccafc8bad,Boston,data+analyst,Business Intelligence & Data Intern,The Boston Consulting Group,"Boston, MA 02109 (Central area)",Business Intelligence & Data Intern 9256BR IT WHAT YOU'LL DO The Business Intelligence & Data Intern will participate in the development activities of our...,NOT_FOUND,https://www.indeed.com/rc/clk?jk=348fbf7ccafc8bad&fccid=b95f9eb47968fa13&vjs=3,2 hours ago
7,p_aa782872952e4857,Boston,data+analyst,Data Analyst,AIR,"Boston, MA",Excellent attention to detail and experience working in distributed with diverse cultural backgrounds. Do you have a passion for math and the sciences?...,NOT_FOUND,https://www.indeed.com/rc/clk?jk=aa782872952e4857&fccid=78c98102e045f43f&vjs=3,21 hours ago
8,p_e615b059536e027c,Boston,data+analyst,Data Analyst,Paytronix Systems,"Newton, MA","The kind of person we’re looking for: We’re looking for an energetic, thoughtful, intelligent, creative thinker to join the Data Insights team. You’ll need...",NOT_FOUND,https://www.indeed.com/rc/clk?jk=e615b059536e027c&fccid=b21b07a5dc052ed6&vjs=3,1 hour ago
9,p_bf41421a19f6332c,Boston,data+analyst,"JUNIOR ANALYST, BUSINESS INTELLIGENCE",PUMA,"Westford, MA","FINANCE JUNIOR ANALYST, BUSINESS INTELLIGENCE Westford, Massachusetts, United States of America At PUMA, we are in constant pursuit of faster. That extends...",NOT_FOUND,https://www.indeed.com/rc/clk?jk=bf41421a19f6332c&fccid=2502c1ff5336df24&vjs=3,5 hours ago
10,p_38ceef765a05a36b,Boston,data+analyst,Data Analyst,Boston Medical Center (BMC),"Boston, MA 02118 (South Boston area)","Strong attention to detail is essential. Analyze large amounts of data, supplying statistical information, managing data and providing technical support to help...",NOT_FOUND,https://www.indeed.com/rc/clk?jk=38ceef765a05a36b&fccid=bb0c672891002d42&vjs=3,7 days ago
11,p_2532431132ffbda1,Boston,data+analyst,Entry Level Data Analyst,Hopjump,"Boston, MA","Entry Level Analyst | Cambridge, MA, United States Sick of those 'entry level jobs' that require 1-2 years experience? If you have an analytical and...",NOT_FOUND,https://www.indeed.com/rc/clk?jk=2532431132ffbda1&fccid=30c994b6c2f39768&vjs=3,30+ days ago
12,p_62e1868c51da667b,Boston,data+analyst,Data Analyst,Boston Engineering Corporation,"Waltham, MA 02451","Job Description We are currently seeking an Information Technology Data Analyst to support the development, and integration of IT solutions internally. The...",NOT_FOUND,https://www.indeed.com/rc/clk?jk=62e1868c51da667b&fccid=7bf54b90d9d7fba1&vjs=3,5 days ago
13,p_996aec632093139e,Boston,data+analyst,Entry-Level/Jr. Business Analyst/QA,Syntricate Technologies,"Boston, MA",We are looking to hire 15 Entry Level Business Analysts and 10 Entry level QA Analyst within the next 5 weeks. Attention to detail / emphasis on quality....,NOT_FOUND,https://www.indeed.com/rc/clk?jk=996aec632093139e&fccid=6a8862eed7fda9a3&vjs=3,11 days ago
14,p_52f4db7748bc4559,Boston,data+analyst,Business Analyst Brand Reebok,Adidas,"Boston, MA","Purpose: < This position plays an important role providing reporting, insights and analysis to senior management as well as helping to manage Reebok...",NOT_FOUND,https://www.indeed.com/rc/clk?jk=52f4db7748bc4559&fccid=8686937f641f561b&vjs=3,1 day ago
15,pj_2a548897181bc9d5,Boston,data+analyst,Marketing Data Analyst II,Carbonite,NOT_FOUND,"3 years / high proficiency with Excel including data model development. Experience collecting, organizing, analyzing, and disseminating significant amounts of...",NOT_FOUND,https://www.indeed.com/pagead/clk?mo=r&ad=-6NYlbfkN0D-MzrjOb7uwVe1Xuf78MsAvmoxMhYszpdaWZ2BM939nc_X30GhKdWfmnQLUhDP4D8CEDnHxlNbeupi1XJIfPUB8zctsmSk-KyoyHzOZgGceUov532WDgSTypPm13OzKMUrueN0fuQm8vfrcxagdZWQ4Xl7d8eM7GWq0C3AnL4pHUVqEDSQZP_5Z7ez-anP9TsPHLiKAw4RulQ9NDKl1iQjrrq8TQpzdKPhY3ERFJONZ9M3ZYZbGmkoUa2MEZaviKIWBaZncC6FHsGMGYjhiOWNUB4a6BRASjK6V0ohQnrUPAzxB5fxlxbMHfoIy3vr_FVGGHUklkz4JZFJbZAWXJY2zCjrpZ8eXt4KILjBDguWs5TwWLkeur2lZgwfTfT8Cg7QzJxz7YauBkv4ysGJGPC-lK9WOEQQpLrzSVliTVbXcyJ1mNkpFikUFMDhiY8DwOhYqgx56xIIOxGHaNwefQ-hyNXJJG-DYktM3T8FtL4--zeeBVkGQ77Oat-hx8F_Dpg=&p=14&fvj=0&vjs=3,NOT_FOUND
16,pj_37976f5481a32076,Boston,data+analyst,Data Analyst II,CodaMetrix,NOT_FOUND,"5 years relevant experience, strongly focused on analytics; 3 years (Required). Ability to work independently and efficiently under time pressure in a fast-...",NOT_FOUND,https://www.indeed.com/pagead/clk?mo=r&ad=-6NYlbfkN0AkmEfxfIvywYkr7FPgbbzZtS80TzOGC0Qwk8jq8kfwxcmRMEv4cXPur2iIiy6S-b2A9S63iQ6y273o04DbbDa8DGeXjpHpilpYvUecdh3-r0EnPObskLpHWJaFb7yLqEv7kpqw5OGXyhjkdQmikH0IOfymgJ1i1gRvh1VoXmJSCjCoC33g67CJzIkoiu9WjrczWoOIGQtGiKq3FFL_5K8pCWnc_dGmVXYqP4b3KoAVWf9IpCnM6o3FZswi-zRyadMe-VVbinKaXwsFSH9WpD5frMdzIFSucG48E7pYCxdMJmrB3PbZqORjw37Jkcjtps6cSIaKW8zODVI0XcX3sZRwqsLhN2uFtyc-9ZgRzUDm14PZEVLOzVVQejp7ali4Ep1kKtMsU4UNat8DagoflvoJclrZoPsrlEQX5xbncorM2IxGx0sbESAj&p=15&fvj=1&vjs=3,3 days ago
17,pj_37976f5481a32076,Boston,data+analyst,Data Analyst II,CodaMetrix,NOT_FOUND,"You will find insights in our customers’ data which surprise even them. Creating and maintaining studies, dashboards and reports which provide new insights,...",NOT_FOUND,https://www.indeed.com/pagead/clk?mo=r&ad=-6NYlbfkN0AkmEfxfIvywYkr7FPgbbzZtS80TzOGC0Qwk8jq8kfwxcmRMEv4cXPur2iIiy6S-b2A9S63iQ6y273o04DbbDa8DGeXjpHpilpYvUecdh3-r0EnPObskLpHWJaFb7yLqEv7kpqw5OGXyhjkdQmikH0IRxmmX4wAFQnczrohMzKfJTealtA_U4gyNoF2-vRek-NMjjBlmdjBRH-8QMcotXYB3FM4NGwie2KqjyyxJWkPUp4pEqyHVlTGFhAp9n5wyIqaulmusMAyovi5qJ8QBJk2ppVTsF5yezqOOsP4HW4SgwI4Bjgp69lo3BLfrsL3ndGDsCEhQV0uvWIYG4iwj6D2NzyCtP2QYUQOqo1t0AqBh50Xrrcw36vlmUZ9amaJnzWthxqbSyJoyHHRzlg_J--CoSSvHy0xou7fbFgVSsTwUqVtRL9B5c3C&p=0&fvj=1&vjs=3,3 days ago
18,pj_712a395f5bbb04b8,Boston,data+analyst,QA Data Analyst,HP HOOD,NOT_FOUND,"That includes health, dental, vision, wellness programs, employee discount programs,. If so, we have an exciting challenge for you and your future!...",NOT_FOUND,https://www.indeed.com/pagead/clk?mo=r&ad=-6NYlbfkN0CybCVwhmkLTCIiqD1-ZFQUpj9tFoSiLejrbuvZUvGjhYWHpqHXQ_ylJ37Z_W_bsjcrwm3pRzBKIr8HUuT_KYdfwqQtpd1STWfyyTjtu9tnEEcYONzp-E4RKkCLc4GeCqTyRepGzv_wrlJz-qt8UOhnEZMagzG2kRHAHG4PkgYKnZPiRYKUplj0nrPJnIbkdwwjtm5exB3GfvWVVvKRcAOVTcFQbZN7rqFyyFRyueKTQMLbtBBghqQYJqdd8jTITwgY1Hio3IujMh9rdbzghzgLHccoGcO14kIaCPdvT5qakUt9QG7S8oIvgCQb_Ov1j6atwZE2EhpF3oVSn4tfzYyrjFhxQKHks9SKTNGZrZE9WXVuAIMBLveZhfUFEVHyQIoaEYvR19yjuih2shcvfiJdHe0_OjnpWEugMa0OB8eSizQFvmcsLmCs&p=1&fvj=1&vjs=3,1 day ago
19,pj_6dc2452979626c70,Boston,data+analyst,Medical Economics Data Analyst,Commonwealth Care Alliance,NOT_FOUND,"Produce thorough documentation, of all reports and analyses. The Analyst will support Medical Economics data and analytics....",NOT_FOUND,https://www.indeed.com/pagead/clk?mo=r&ad=-6NYlbfkN0AvPKJZYie4hMaqdKsGd0vZzY7dSsPLmlqcV6s58mlFZOvCRWW_jxi69njVRGxlsVUn0SwKI2eBQVqKXpxFZ8tBss3XAGxaZJc9iEW3a0oHTa2Llo2DtSgHiZ_E0_58wTYN9DXOYH9bRgXTKhhhRfKwzSrYycPd4UrXEaSjQRfF1KZRgdVdYhuCylk5DaDdwgr1x9Dae-1Eb5Q_m70hKfvYUPqgPN4K98InmqC8meuJfDQWF_qrcOxX0nRBdtKIWb8OJW8WbmvXES5I_ckK9iKlqrVAxtJ6okS01yNXNn5BQVo5DEOMPoMMz_5-AoJJBQq4reYr4mHuCGPAAWTOQz5-2fW7eWCmU6yf9eeyeBpE01JmZ0iitsz9yQyeajUkdSRBQY-fCuC9Q2Lx8cB0y9APNQAIQdWPK7Kk0sp9o0MJiCqSG-LJpHSTSgf-J5QR4n1d3nH0feDpupUcv47XQLlfBGIJCaTknnBcPjnNJGVLCg==&p=2&fvj=0&vjs=3,NOT_FOUND
20,pj_fb355b19441bb448,Boston,data+analyst,Data Analyst,Indeed Prime,NOT_FOUND,"We look for top tech talent to join the Indeed Prime platform. Get career coaching – Level up with free 1:1 coaching, our team will make sure you're ready to...",NOT_FOUND,https://www.indeed.com/pagead/clk?mo=r&ad=-6NYlbfkN0DhVAxkc_TxySVbUOs6bxWYWOfhmDTNcVTjFFBAY1FXZ-EFN3cXsFacyjbJwnCPXT8pu1IIVxX8o1IMegaEPUNeN__Uobs3YB_VokyltCmkQgRUrRBaM9GC98GdKvjsqlKlqNvKR7vn6vt_wmUifQWoFyo5lLQe0r9xYWrIFKPCD03JUmxKoy4mC_-AW2oPq5hqxHGa8XgrMRIWaZUzG-dU1QeIfBGNhlKt8FYBHY_OypgiuOzDklgbs3GBs2YCGA8-F2C9frRzKHeNyZtldGDYcRo55tSjnSPUlMs-dGcjk05uqwhUyc8xnZwsg0d_Wxu8XanIinmHIsV9lTAItYwTGHJ7Ch_eCkfPNGh5nCsImZu6w4uHjJon4-71fzA8O7Y8R8CnP7rRzn12KUxG7e7eyXthHkbS0I5FsVFm26q0haoUArjRby2HpVb54RIzfQs2514K_ivlzKdPpaxy_4Y9Ju_vbhn32eH5ptd4m16tVl-WSuddxp79VmC90L4DbP3vKXw8Z2lu41KDBj2BbOf3Czdn_ycO_NfdewTJFqtSWA==&p=3&fvj=1&vjs=3,NOT_FOUND
21,p_29510558fbbeccd5,Boston,data+analyst,3D DATA ANALYST,Boston Planning & Development Agency,"Boston, MA","Programming languages C#, python, R, Javascript. Introductory experience with standard spatial analysis tasks especially Modelbuilder for 3D model maintenance...","
                $62,500 - $69,400 a year",https://www.indeed.com/rc/clk?jk=29510558fbbeccd5&fccid=b2b4391b9f00665b&vjs=3,2 days ago
22,p_28b8acb0f18ae283,Boston,data+analyst,Data Analyst,Boston Children's Hospital,"Boston, MA 02115 (Fenway-Kenmore area)","This Data Analyst will be responsible for:. At Boston Children’s Hospital, success is measured in patients treated, parents comforted and teams taught....",NOT_FOUND,https://www.indeed.com/rc/clk?jk=28b8acb0f18ae283&fccid=847fa4d5cb464f5a&vjs=3,30+ days ago
23,p_d567890833c390c6,Boston,data+analyst,Data Analyst,Boston Technology corporation,"Boston, MA","The analyst will work on bring in new ESG data, cleaning and organizing data, establishing data quality checks, analyzing data trends, producing data...",NOT_FOUND,https://www.indeed.com/company/Boston-Technology-Corporation/jobs/Data-Analyst-d567890833c390c6?fccid=c45ceaf8343875a7&vjs=3,21 days ago
24,p_3e6f78a2ee52f22c,Boston,data+analyst,Data Analyst I,Massachusetts General Hospital(MGH),"Boston, MA 02114 (Back Bay-Beacon Hill area)",The Neuroanesthesia Laboratory is recruiting a Data Analyst I. Excellent verbal and written communication skills....,NOT_FOUND,https://www.indeed.com/rc/clk?jk=3e6f78a2ee52f22c&fccid=3aaabf5c54e51db9&vjs=3,30+ days ago
25,p_37976f5481a32076,Boston,data+analyst,Data Analyst II,CodaMetrix,"Boston, MA 02116 (South End area)","You will find insights in our customers’ data which surprise even them. Creating and maintaining studies, dashboards and reports which provide new insights,...",NOT_FOUND,https://www.indeed.com/company/CodaMetrix/jobs/Data-Analyst-37976f5481a32076?fccid=2698ff1aeda0f8b3&vjs=3,3 days ago
26,p_8e82762945c5a88a,Boston,data+analyst,Data Analytics Analyst,IQVIA,"Cambridge, MA","Develop, Maintain, and Manage Best Practices. Forge a career with greater purpose, make an impact, and never stop learning....",NOT_FOUND,https://www.indeed.com/rc/clk?jk=8e82762945c5a88a&fccid=6b7a1dfe07e7f037&vjs=3,1 day ago
27,p_418bf857d16b705b,Boston,data+analyst,Analytics & Insights Data Analyst,Uber,"Boston, MA 02114 (Back Bay-Beacon Hill area)","Build, maintain, and scale detailed reporting suites & models. For this role you should have excellent analytical skills, time-management and organizational...",NOT_FOUND,https://www.indeed.com/rc/clk?jk=418bf857d16b705b&fccid=f766f8bfbc3effb7&vjs=3,30+ days ago
28,p_97a4167bf3e417fb,Boston,data+analyst,Data Modelling Analyst 1,Experian,"Boston, MA",Able to interact confidently with senior management. Identify areas of process improvement and optimization opportunities....,NOT_FOUND,https://www.indeed.com/rc/clk?jk=97a4167bf3e417fb&fccid=75a3a5a15b202084&vjs=3,12 days ago
29,p_ce720ab26a9f5ef6,Boston,data+analyst,Data Quality and Process Analyst,Commonwealth of Massachusetts,"Boston, MA 02108 (Back Bay-Beacon Hill area)",III. No. Experience with facilitating discussions with staff to gather project requirements. Day. Experience with working with Microsoft Power BI....,"
                $63,189 - $92,072 a year",https://www.indeed.com/rc/clk?jk=ce720ab26a9f5ef6&fccid=4dd38d4e4cf0b7c0&vjs=3,1 day ago
30,p_c9daedacda9fbabd,Boston,data+analyst,Associate Data Solutions Analyst,comScore,"Boston, MA 02116 (South End area)",Performs QA checks on custom work created by team. Successful candidates must pass the E-Verify process after hire....,NOT_FOUND,https://www.indeed.com/rc/clk?jk=c9daedacda9fbabd&fccid=b39fb6f124ce8586&vjs=3,21 days ago
31,pj_2a548897181bc9d5,Boston,data+analyst,Marketing Data Analyst II,Carbonite,NOT_FOUND,"With our robust Data Protection Platform, we are well-positioned in a rapidly growing market. Add value by providing ongoing reporting and analysis on specified...",NOT_FOUND,https://www.indeed.com/pagead/clk?mo=r&ad=-6NYlbfkN0D-MzrjOb7uwVe1Xuf78MsAvmoxMhYszpdaWZ2BM939nc_X30GhKdWfmnQLUhDP4D8CEDnHxlNbeupi1XJIfPUB8zctsmSk-KyoyHzOZgGceUov532WDgSTypPm13OzKMUrueN0fuQm8td_iD0QTW-gYB-HrQpgtJG4Qb1oDZoZKzH4oCxcfGdaYC8EuBShtDWv1jx3JoAjbzoJ1PlXAY9PLvV6oguXcWFrb_vJsGKmSg0hZIrEIqzWkkpyCxBW3RG_LlunmKrjlina2RCJ1YugvP0OGwi83GLefH_409y3CvovSMNdRiSO_eXoxbmBdFSwS3qkpXHe-wUnbp5D1B-g7BB9sZ9s3iP1L1XogjwW1SsBpNEV9AYCtVKrKdhPwDi_1_tEps5F3p-_ETcCYfwtVtBkH4wa5G8yk99RRqavYfn6x5ymSYFq95lpx76y-bppC3s5I55YEtx_VHr6qawUnYFyl5VBk-BKqpLZoCIF43Xi8M1vVQqq5ZCzcGGa9ac=&p=14&fvj=0&vjs=3,NOT_FOUND
32,pj_5164f499ca3cbbaf,Boston,data+analyst,Data Analyst,Forward Financing,NOT_FOUND,"Optimistic, open, and objective toward others. We offer a comprehensive benefits package including medical, dental, vision and commuter benefits along with gym...",NOT_FOUND,https://www.indeed.com/pagead/clk?mo=r&ad=-6NYlbfkN0CuoFyY3--MdiSzQkIQ3K4ehh0zNtndF9kZFlmc8DmBu-iBShQlMAFb2W7hWrEbC_Wu1VGsSmzxHfAGolcO8QK0TuJeYXMOqWCbLcZ93woKc09ws5uNpTlODrDEauk3Isx1FtHmugwULbhhMrlYK3qAWgoxTKRMf83oxCaaqu01tf0viKlklyoK5gOZz3W4ulxjP_jSWGCGne2emizRiAJG2K9lTKC69XrXWj16dDnf2apZqmGuU33NnXBEtfOVI8yVRylFZaI-oAo5hvibz_Vq0thZ27Au-VNR7K3qyNNkd8O4d2sRFzIEYMEoOF2ed4xYKgnL2uiOosYXKidaqnfTsw3LxWAkmmFEpq5VipWSpsJInir3A6gHBBzDsZESqaOClUAtyBVshNzTmfNycx3ufBZl3BCe67RennS6anOYoLQAqucyln09NJrmWzki-6Ygldq0teG-wC5dBfCJU7AeKR0IMjAAdEkXDWprCXrcpAplcQXRVLUZmGFO64Hk0hQ=&p=15&fvj=0&vjs=3,NOT_FOUND
33,pj_6dc2452979626c70,Boston,data+analyst,Medical Economics Data Analyst,Commonwealth Care Alliance,NOT_FOUND,Strong organizational skills and attention to detail. The Actuarial Services Department makes extensive use of SAS and SQL programs to produce the data and...,NOT_FOUND,https://www.indeed.com/pagead/clk?mo=r&ad=-6NYlbfkN0AvPKJZYie4hMaqdKsGd0vZzY7dSsPLmlqcV6s58mlFZOvCRWW_jxi69njVRGxlsVUn0SwKI2eBQVqKXpxFZ8tBss3XAGxaZJc9iEW3a0oHTa2Llo2DtSgHiZ_E0_58wTYN9DXOYH9bRr3MQyiXSAR4BJOuK5g9272C4n5aaXFCYBOCzoytGVQxq3y5NzIt2ZgeUO_-UPbNCUnPihLRUccElg70VjNJDCZgUIy9ZVCSng0pi3CyH7CRecXpNGsrJE1ToNjvE2zHd8CwuXGVkWnHRn4EpL_AfhxJYoHH75dqh-5Q3F2Y5OEBt_BH5dUU_Zr1maJOuiBIeDiISyn3CjBtmuYw7nRWRgtpZrbUJpGzhtL6s1itcz8LibNR7rqF7fFiOhmgEY-88XKiqM49TZjv2l9w20PD332OTIuC_aSPC2RMEp7Ucr24g3Vv-T-635FHgRGVDy_M-ZZDHwnYZBTIT0ckoaS_MFdM6s1JTeUBdg==&p=0&fvj=0&vjs=3,NOT_FOUND
34,pj_a9461464b73a7f8d,Boston,data+analyst,Credentialing Data Support Analyst,Teladoc Health,NOT_FOUND,"*Mission to Our Employees: * Teladoc Health is the global virtual care leader, offering the only comprehensive virtual care solution spanning telehealth,...",NOT_FOUND,https://www.indeed.com/pagead/clk?mo=r&ad=-6NYlbfkN0ANOqaQNUBoSqcMsaId134EERy20I5OiaTrIG0V3qjKB-1lLN3BBXKgX0YtZPAHUP3MHKqo8b7J2mX1LxzF6uzVEsLG3t23X8atlF3Wtm8a7Ybs6hX1HTrUvYiZvzDbvpSEX6X2HhJBkWv32xjPxHPKGiJi45DPQ-2uL19xYg9V-B94DWE1oN3tb75B-vpimI7ewNVWgsIvpoora5HKVB5bTxnMOW5vim9ZBGsFPv2vmKBh9W_vM-2GGfpYOc-5C9J2SjV9d5Em3f7ejhWR0PNgehS-uUBu9A7IEKBcpFdaCP4mqJneBvL7RCmRpkxkFtZg_9RcG-0XPCJCurBfH4G7cXtTdOIsYQEJE163STrO0nvn3jqmdXe3OKJotBVROqb3v8EsQljLzgOh7ecN-VcKcvYtG2xAX91J8CFebtDi6KUZpr95CmHHPs-opdzNyr8=&p=1&fvj=1&vjs=3,NOT_FOUND
35,pj_37976f5481a32076,Boston,data+analyst,Data Analyst II,CodaMetrix,NOT_FOUND,"5 years relevant experience, strongly focused on analytics; 3 years (Required). Ability to work independently and efficiently under time pressure in a fast-...",NOT_FOUND,https://www.indeed.com/pagead/clk?mo=r&ad=-6NYlbfkN0AkmEfxfIvywYkr7FPgbbzZtS80TzOGC0Qwk8jq8kfwxcmRMEv4cXPur2iIiy6S-b2A9S63iQ6y273o04DbbDa8DGeXjpHpilpYvUecdh3-r0EnPObskLpHWJaFb7yLqEv7kpqw5OGXyhjkdQmikH0IRxmmX4wAFQnzVXwGKtzExdoMhfTzYsAy7Y6kfhbxbyjPqHcM7qH6pgKm8HeU3KmE4cDJrb_gE6sivYhPmWzfiCCR_Qpv4HajF2DsWZz-lFU4rW9ZGypRyn1wV-sjux6_6Tgvih1HBLfdgg6g9U6v9lRT9OWAi4KdLnjNbZOoAjG4sXWvBAQES3noQFBryAB86B20dJyLZclfH16ggtALj9d4yZx43biRrV4K6P8DqANulEGH64pbLgTSwL0hWCaZkyAYURrGHdLO71M_Aw7azDYDLKVr2iJ8&p=2&fvj=1&vjs=3,3 days ago
36,pj_712a395f5bbb04b8,Boston,data+analyst,QA Data Analyst,HP HOOD,NOT_FOUND,"QA Data Analyst - HP Hood Are you a self-driven person looking to advance your career as a high-impact player on a team? If so, we have an exciting challenge...",NOT_FOUND,https://www.indeed.com/pagead/clk?mo=r&ad=-6NYlbfkN0CybCVwhmkLTCIiqD1-ZFQUpj9tFoSiLejrbuvZUvGjhYWHpqHXQ_ylJ37Z_W_bsjcrwm3pRzBKIr8HUuT_KYdfwqQtpd1STWfyyTjtu9tnEEcYONzp-E4RKkCLc4GeCqTyRepGzv_wrlJz-qt8UOhnOYXe0e3sdzKe2FcJhT3TggXo2Lty740M5CKKd06Ok9s7HAFZt5ctDItCunf2BFcZSWC0q16uVSAUs11X6Yf2DFDUm9W96yxNwk_3pXRmopUZO9jmxywBOZdoeFdz9CmglnPDds4s2-rm70IGtbY7mcVmjCLpjoeHvhfk0FE7oKJLYetYz6WFMwJ9bAHjvIXNQAlF2hfCpK2zYFfnONFtdX0zGvAIDhzeXywZONu7_UxKhgIH8KE8ckamUIUKwkrW0yYCY6Y-d2aYmtYsRSNT2toGvQfR5tR8&p=3&fvj=1&vjs=3,1 day ago
37,pj_2a548897181bc9d5,Boston,data+analyst,Marketing Data Analyst II,Carbonite,NOT_FOUND,"3 years / high proficiency with Excel including data model development. Experience collecting, organizing, analyzing, and disseminating significant amounts of...",NOT_FOUND,https://www.indeed.com/pagead/clk?mo=r&ad=-6NYlbfkN0D-MzrjOb7uwVe1Xuf78MsAvmoxMhYszpdaWZ2BM939nc_X30GhKdWfmnQLUhDP4D8CEDnHxlNbeupi1XJIfPUB8zctsmSk-KyoyHzOZgGceUov532WDgSTypPm13OzKMUrueN0fuQm8m43re29cdU5pJy2iMvAqjC-V8Gm6ufN0AJ2Wo3yErmfNfrhsJLnBnXmDUjfg3FRVMnghQ3saoCXqWVChrlCgVFn9t28MzHIs6QTJ3QON8nmp022N-n8AYUaCVNr19P3i5y12QUYsbmkki8FNOMzGiPatfn0Bv37mZHTHvbtEIzSwpKH7Pod-bWDj7Bpb57vdhegH1eW85Lr1at3BlRDyDIvI8xaPJh_mchOlEqHqXLIxmjwhyPZzJMh3TpFAf5M13QoobU-vw6-GD3NI0w_qKj2gKX3GuwXxAxbL25sPOE8zshxAgKMST4XGpi2she2rsx17toC5VqSPgLHflmia60iE1KbXuiGsSXb0HaT-OMx6ZtKiHFFCbk=&p=4&fvj=0&vjs=3,NOT_FOUND
38,p_137ceb416b619786,Boston,data+analyst,Quality Improvement Data Analyst,Boston Medical Center (BMC),"Boston, MA 02118 (South Boston area)",Detail oriented with a commitment to producing analytic product that consistently meets the highest standards of accuracy....,NOT_FOUND,https://www.indeed.com/rc/clk?jk=137ceb416b619786&fccid=bb0c672891002d42&vjs=3,13 days ago
39,p_e615b059536e027c,Boston,data+analyst,Data Analyst,Paytronix Systems,"Newton, MA","The kind of person we’re looking for: We’re looking for an energetic, thoughtful, intelligent, creative thinker to join the Data Insights team. You’ll need...",NOT_FOUND,https://www.indeed.com/rc/clk?jk=e615b059536e027c&fccid=b21b07a5dc052ed6&vjs=3,1 hour ago
40,p_996aec632093139e,Boston,data+analyst,Entry-Level/Jr. Business Analyst/QA,Syntricate Technologies,"Boston, MA",We are looking to hire 15 Entry Level Business Analysts and 10 Entry level QA Analyst within the next 5 weeks. Attention to detail / emphasis on quality....,NOT_FOUND,https://www.indeed.com/rc/clk?jk=996aec632093139e&fccid=6a8862eed7fda9a3&vjs=3,11 days ago
41,p_418bf857d16b705b,Boston,data+analyst,Analytics & Insights Data Analyst,Uber,"Boston, MA 02114 (Back Bay-Beacon Hill area)","At Uber, we ignite opportunity by setting the world in motion. We take on big problems to help drivers, riders, delivery partners, and eaters get moving in...",NOT_FOUND,https://www.indeed.com/rc/clk?jk=418bf857d16b705b&fccid=f766f8bfbc3effb7&vjs=3,30+ days ago
42,p_a5c2f8b16d39ccc1,Boston,data+analyst,Data Analyst / 40 Hrs / Day / Transplant Administration / BWH Main Campus,Brigham & Women's Hospital(BWH),"Boston, MA 02115 (Fenway-Kenmore area)","Comprehensive attention to detail. The BWH Transplant Programs consist of Heart, Lung, Kidney, Pancreas, Kidney / Pancreas, Face, Tissue, and Composite tissue....",NOT_FOUND,https://www.indeed.com/rc/clk?jk=a5c2f8b16d39ccc1&fccid=053c0caee91baa24&vjs=3,8 days ago
43,p_712a395f5bbb04b8,Boston,data+analyst,QA Data Analyst,HP HOOD,"Wilmington, MA","QA Data Analyst - HP Hood Are you a self-driven person looking to advance your career as a high-impact player on a team? If so, we have an exciting challenge...",NOT_FOUND,https://www.indeed.com/company/HP-Hood/jobs/QA-Data-Analyst-712a395f5bbb04b8?fccid=9f89cde7b83eec4c&vjs=3,1 day ago
44,p_37976f5481a32076,Boston,data+analyst,Data Analyst II,CodaMetrix,"Boston, MA 02116 (South End area)","5 years relevant experience, strongly focused on analytics; 3 years (Required). Ability to work independently and efficiently under time pressure in a fast-...",NOT_FOUND,https://www.indeed.com/company/CodaMetrix/jobs/Data-Analyst-37976f5481a32076?fccid=2698ff1aeda0f8b3&vjs=3,3 days ago
45,p_5b46b4ef7e750560,Boston,data+analyst,ICP 1 - Data Analyst,Beth Israel Deaconess Medical Center,"Boston, MA",Department Description: The Division of Infection Control/Hospital Epidemiology is part of the Silverman Institute for Health Care Quality and Safety with a...,NOT_FOUND,https://www.indeed.com/rc/clk?jk=5b46b4ef7e750560&fccid=e22cfd26c0a5b241&vjs=3,30+ days ago
46,p_bc88d8fad1a17d39,Boston,data+analyst,Clinical Data Analyst,CliniWorks,"Cambridge, MA 02142 (East Cambridge area)","3 or more years of experience with data extraction, manipulation, analyzing and reporting data. CliniWorks is seeking a Clinical Data Analyst to join a growing...",NOT_FOUND,https://www.indeed.com/rc/clk?jk=bc88d8fad1a17d39&fccid=4c1434025197c41c&vjs=3,9 days ago
47,p_3eac5d541e519ae7,Boston,data+analyst,Data Analyst,Berkshire Hathaway Specialty Insurance,"Boston, MA",Perform data validations and reconciliations between various sources and reports with precision and attention to detail to ensure deliverables are accurate and...,NOT_FOUND,https://www.indeed.com/rc/clk?jk=3eac5d541e519ae7&fccid=8a4ef15aded30e15&vjs=3,19 days ago
