,unique_id,city,job_qry,job_title,company_name,location,summary,salary,link,date
622,pj_712a395f5bbb04b8,Boston,data+analyst,QA Data Analyst,HP HOOD,NOT_FOUND,QA Data Analyst - HP Hood. Presents numerical data effectively. Publish data trend analysis reports. Work with department directors to assure data accuracy ....,NOT_FOUND,https://www.indeed.com/pagead/clk?mo=r&ad=-6NYlbfkN0CybCVwhmkLTCIiqD1-ZFQUpj9tFoSiLejrbuvZUvGjhYWHpqHXQ_ylJ37Z_W_bsjcrwm3pRzBKIr8HUuT_KYdfwqQtpd1STWfyyTjtu9tnEEcYONzp-E4RKkCLc4GeCqTyRepGzv_wrlJz-qt8UOhnmLV0TgukPcESausmvUSsoO01GSQ-M6ZsPj_XGn-NBAGlRT5U2G0zAPstcb_WtIxufUuGNr9Njc5xleZEJPlCb0300xqNU9MOZzSdjcBJO8TO8ysn1STdBncTfcfw4AoXyJQFp-lf9VN3iGzjeqb1vujIIBhkzU-cp_1ssZLBQQ9V8VsboOPmk0CAsv1yCOYZAhSMdfx0FDPi_9jB7HGWuFvYpV2R8hNfoHjSi9aiMgZq1Ouoxiri81Qjsv9rWrjnGg_Er82Kw4UFUY6chSPhKSEDj08o001_&p=2&fvj=1&vjs=3,1 day ago
623,pj_2a548897181bc9d5,Boston,data+analyst,Marketing Data Analyst II,Carbonite,NOT_FOUND,3 years of work with SFDC data. 3 years / high proficiency with Excel including data model development. There will be data challenges along the way....,NOT_FOUND,https://www.indeed.com/pagead/clk?mo=r&ad=-6NYlbfkN0D-MzrjOb7uwVe1Xuf78MsAvmoxMhYszpdaWZ2BM939nc_X30GhKdWfmnQLUhDP4D8CEDnHxlNbeupi1XJIfPUB8zctsmSk-KyoyHzOZgGceUov532WDgSTypPm13OzKMUrueN0fuQm8nWExH8X-axsgzvGVLpszcMskl4p5m3GfsJCMHwiQk89ifPv6UIFwlTOK9kRU3jpNlZVL8zipbDOwZ16MIq86uEEn2TV6Ds8dRJWBAppqDB5WEJXntOwqrstECUcIPbbykWVvFYP3C-X9UPKPZponWlBAZb1tMnJe06QUXTevllNJVdUuM21pKeE619Yvc28kYPF0zyah3rObOLSYHorXtegaxmpKvQD7NnJuXhdCNCbgVAghCeBF233GVVKEW0hDI-bmddpXOk3FTW7bOxBxANpsxGpeyiP5Wukql0gMuth7RpTDSrA2o63IwAzRf5EsrdWVWfWWQdULE0B5kHKVp-o2PZK1GpuJn5WD-nfAIF1wRINxrpNSXE=&p=3&fvj=0&vjs=3,NOT_FOUND
624,p_1c1070b7f628167a,Boston,data+analyst,Data Analyst / Quantitative Data Analyst,Hopjump,"Cambridge, MA","Analyst | Cambridge, MA, United States. We're looking for analytical thinkers interested in scaling our business and using big data to give our users the best...",NOT_FOUND,https://www.indeed.com/rc/clk?jk=1c1070b7f628167a&fccid=30c994b6c2f39768&vjs=3,30+ days ago
625,p_5a1615cd1dcdaf25,Boston,data+analyst,Data Scientist,Massachusetts Eye and Ear Infirmary,"Boston, MA 02114 (Back Bay-Beacon Hill area)","Able to understand various data structures and common methods in data transformation. 5+ years’ practical experience with ETL, data processing, database...","
                $106,000 - $156,000 a year (Indeed est.)",https://www.indeed.com/rc/clk?jk=5a1615cd1dcdaf25&fccid=126bc76b4600a831&vjs=3,30+ days ago
626,p_28a59b8820b9e47b,Boston,data+analyst,"Research associate, wholesale banking","Aite Group, LLC","Boston, MA 02110 (Central area)","As a research associate within our Wholesale Banking practice, you will provide ongoing support to banking analysts and clients....",NOT_FOUND,https://www.indeed.com/rc/clk?jk=28a59b8820b9e47b&fccid=d975a7b2d4490fad&vjs=3,30+ days ago
627,p_516158055769956e,Boston,data+analyst,Quantitative Analyst,Enel Green Power North America,"Andover, MA 01810",This role entails assisting traders and risk managers with data requests and analytical support utilizing advanced data science and programming skills....,NOT_FOUND,https://www.indeed.com/company/Enel-Green-Power/jobs/Quantitative-Analyst-516158055769956e?fccid=e5f0cfd526c9c18f&vjs=3,2 days ago
628,p_70134f55ad2cf625,Boston,data+analyst,Data Analyst,Analogic,"Peabody, MA 01960","4+ years in analyst role with data mining experience (Big data). As a data analyst, you will support the Field Service and Customer Support team by interpreting...",NOT_FOUND,https://www.indeed.com/rc/clk?jk=70134f55ad2cf625&fccid=9cb1c8b83440c0cf&vjs=3,30+ days ago
629,p_da610d2882def20d,Boston,data+analyst,Data Analyst,Lynn Community Health Center,"Lynn, MA",Acquire data from primary or secondary data sources and maintain databases/data systems. Decision Support and Data Analytics....,NOT_FOUND,https://www.indeed.com/rc/clk?jk=da610d2882def20d&fccid=bd357d42451eefc1&vjs=3,30+ days ago
630,p_f0f57ed70da0a939,Boston,data+analyst,Immunization Data Quality Analyst,"John Snow, Inc. and JSI Research & Training Instit...","Boston, MA",Identify data discrepancies and troubleshoot problems related to missing or miscoded data. Execute queries of data in data warehouse and run reports through the...,NOT_FOUND,https://www.indeed.com/rc/clk?jk=f0f57ed70da0a939&fccid=1cc0bad63dadc919&vjs=3,30+ days ago
631,p_72673b01393aece3,Boston,data+analyst,Quantitative Marketing Analyst,Wayfair,"Boston, MA","As a Quantitative Marketing Analyst ... As such, Quantitative Marketing Analysts drive experimentation, decision-making, and implementation of Wayfair's growth...",NOT_FOUND,https://www.indeed.com/rc/clk?jk=72673b01393aece3&fccid=95485c6456ed2114&vjs=3,28 days ago
632,p_426fc7205a665cae,Boston,data+analyst,Digital Communications Analyst,MIT,"Cambridge, MA 02142 (East Cambridge area)","Will oversee the collection and analysis of data sources from across MIT to inform strategic decision-making and support experimentation with new content,...",NOT_FOUND,https://www.indeed.com/rc/clk?jk=426fc7205a665cae&fccid=71cf745ec1b3aae4&vjs=3,30+ days ago
633,p_ddce0409f013ae9d,Boston,data+analyst,Portfolio Analyst,Man,"Boston, MA",Work with large data sets and liaise with outside data vendors to identify data quality issues Design tools for evaluating portfolio implementation and...,NOT_FOUND,https://www.indeed.com/rc/clk?jk=ddce0409f013ae9d&fccid=3ce8f80e77287080&vjs=3,13 days ago
634,pj_2ed4269ec24c5a71,Boston,data+analyst,Space Planning Analyst,SAS Retail Services,NOT_FOUND,"We’re looking for Planning Analysts to join our growing team! You’ll learn about consumer insights and how you can use them, along with market data, to meet...",NOT_FOUND,https://www.indeed.com/pagead/clk?mo=r&ad=-6NYlbfkN0D32AtJmRARqp3mPvj2wcN4e_HwHaBMPLToiD5CY_lcraBuK3NPtewIv7Npyc7l_18vb1u4YKklMGm5hp4axQCVHkc6jydTiP2lMu4bPjj096CXorNA7ylyNFGsf-kuyf_5C3RO2i2DT1Z9CEtz0O2bc8DYH1a3F98snFayTLQPN7cR49EPZR-HN7yNb2JPR9ewFKiCoGyyTp16ghljLkcxbPxXXj_zKsM04UEMKAidyC0t-sEEoi_-nt3in0hyZczgoSwW0imND6rIacy7mlXyVJduRoHB0Fl-Mzo9iW9jDc4Y99joGoLIkbHS7gEcXjVvLqsbBheql9El2IqzPVZoZhg30JLMVLpRRJHs5_EZVgllvqcZEw30hR8Nb1hSfn3AltO0pl5F9fGylXbRm0_3-YkVd6k4618lFDseF9d34I_-hEI34D8P&p=14&fvj=1&vjs=3,NOT_FOUND
635,pj_dc6afd9175b203fa,Boston,data+analyst,Royalty Analyst,Hachette Book Group,NOT_FOUND,"Validate monthly financial data for month-end general ledger reporting. Excellent organizational skills with the ability to multi-task, prioritize and manage...",NOT_FOUND,https://www.indeed.com/pagead/clk?mo=r&ad=-6NYlbfkN0DL68TXyauRvgJshQFvl0CXX9IUYxuQWsknLS_AKZyJ1tTw4-HnBztNCt23CVimEqwICvoZJFsQhLAIYj6MhI3WnMYTRKwsypUW1W_RXEFQEFo8pLbTS86VATTDSpB-Dn_3QdXm5QeqHJuH4xKWx6OSUcXlnb8deSoI3MdkJJSkVcRsqSyxPdCRECDwwITW7BcfJuZQMaP2MhdEsWXJFrcO06NCkUc-FSigeIlubnM_19Kvy5XyQCmQZSjPDwYoJpruNiWnNeluF7Q-6GCOxjBX7wUXwSNkk0EwcI074ORvVDTa_n0HE-bHsjGls5wIwKhb4wBm8IP_N5gVK_dcWkazjbJYxlVZ5DraC4JTUZhHtFMcrvkuJVujqQP2VDbSddaGpoYOT-4sb284fVB13nyhfOUe9KfbK5VBXtwK0iKV-zfpYppVqf2EksIe03BxXb1bZSWOoxRbU9h0doWX41o4oq5c8wVA10s2K01k0YuduHrgyAJpt7VOM_3quN-8ZqwRUhnyYRarmCQeyCwUsVTK&p=15&fvj=0&vjs=3,NOT_FOUND
636,pj_5164f499ca3cbbaf,Boston,data+analyst,Data Analyst,Forward Financing,NOT_FOUND,"As a Data Analyst, you will play an important role in harnessing the Company’s data and analytics to provide valuable insight and analysis that will be used to...",NOT_FOUND,https://www.indeed.com/pagead/clk?mo=r&ad=-6NYlbfkN0CuoFyY3--MdiSzQkIQ3K4ehh0zNtndF9kZFlmc8DmBu-iBShQlMAFb2W7hWrEbC_Wu1VGsSmzxHfAGolcO8QK0TuJeYXMOqWCbLcZ93woKc09ws5uNpTlODrDEauk3Isx1FtHmugwULbhhMrlYK3qAjzKTUEcZ9Ul6f1rVesuSFg75IWkFjfeIZhs7ycxaD8yg1bi9wb8A4F8ONUybjr_YKmJ2SlZY-B1fvNWRGZ4Zg5ix3R64DZQCrs94g0nFQYYC6SKOpoibTPTWZuuA8jwmwD_sjWA2vSBYv3PL3ankutEp42-fML3xIkAuBTm6rmlf9h9uIbG4r8D8ZUNG5CYRVs1jIjXRJ0sQvIQjM4SkNspcetw2H7008tjMii9vRx97inFXRNOgHztAX0oyd_bqNnMMFDfugfmsFbvRvnijp8Oe9xubRnRMQZAW9goMckIXIXxrOMxi9tA6Lt4PH12oXGBl0HkhRU03HHS37s9UyTkQTYFizlmRMUnANVhRPeA=&p=0&fvj=0&vjs=3,NOT_FOUND
637,pj_37976f5481a32076,Boston,data+analyst,Data Analyst II,CodaMetrix,NOT_FOUND,"Filtering and “cleaning” data by reviewing reports, data files, and performance indicators to expose and plan corrections to code or data problems....",NOT_FOUND,https://www.indeed.com/pagead/clk?mo=r&ad=-6NYlbfkN0AkmEfxfIvywYkr7FPgbbzZtS80TzOGC0Qwk8jq8kfwxcmRMEv4cXPur2iIiy6S-b2A9S63iQ6y273o04DbbDa8DGeXjpHpilpYvUecdh3-r0EnPObskLpHWJaFb7yLqEv7kpqw5OGXyhjkdQmikH0IoosI6KbOOoGIIoAOK8RS1YDYTfzlq553yMTngj2jaEaZoAOhlX4_HasmlSGQ8uj_igTN1JcFDP9Fb4NdKoH91AbJhoARCNUV9monL4cPWpOJ5VWiWjGWZ_mH5yYztZC1eo2R34NhZy2w6j1C-ropt3MdaQor2s6eMn3xP4MyxiyOW6rlq8gwP-UHg0b7PgvRc7sLOC3JzESVAT8vTrciuoAtyg7eSXacoZWrKdYz7qpVQc3uPliPzhL0yPjaUksEIpmK9miUnEYDrsqWksv1jsgVEKD0LSq-&p=1&fvj=1&vjs=3,3 days ago
638,pj_712a395f5bbb04b8,Boston,data+analyst,QA Data Analyst,HP HOOD,NOT_FOUND,QA Data Analyst - HP Hood. Presents numerical data effectively. Publish data trend analysis reports. Work with department directors to assure data accuracy ....,NOT_FOUND,https://www.indeed.com/pagead/clk?mo=r&ad=-6NYlbfkN0CybCVwhmkLTCIiqD1-ZFQUpj9tFoSiLejrbuvZUvGjhYWHpqHXQ_ylJ37Z_W_bsjcrwm3pRzBKIr8HUuT_KYdfwqQtpd1STWfyyTjtu9tnEEcYONzp-E4RKkCLc4GeCqTyRepGzv_wrlJz-qt8UOhn3Nxg8An6fJ_vm91TpbdWo-Kom62KiBmLSJG9mvt-yb-6uVx2hU0gmQ7rCV45Fu3rWDkJvdaiCkcTWRIqhlkC7UFipxKFpfrQ2dowoYtLu-dpL1N8FHCpfRyAW4iA7ZemLEqN-3vOodEhsINLSvcHI22cXaj5D8OriA5GXHDPB9mz3lbHg6Vm-OjcyWnu5mbbv6Cnj5NG_fWr0K16z9fk4cFspfF5UY0Ihs5M0c5VsVF6FID-5LYKv6vYASYyFThToHqUAtVCI5W6UkQt9OBlQDzbKONV0kp4&p=2&fvj=1&vjs=3,1 day ago
639,pj_9e5a1caef45f8609,Boston,data+analyst,Leader of Foundational Data Architecture,Wayfair,NOT_FOUND,"Lead several teams to develop core data assets used by data professionals across the company, including hundreds of data scientists and thousands of analysts....",NOT_FOUND,https://www.indeed.com/pagead/clk?mo=r&ad=-6NYlbfkN0BWKOYaUJfzlpbj8B4EVHsr8Rk3do3CBb7WzQD7M0cgO4MmQYBeubwD0nUaCahAaLiFiR7VY9juaicvsEnHjx5S9LMP7j1i8TBevWVfLZuuDdWZS4PDEwHDQlQn7ESmsQX6RIrZ6QM7-8Xl1TBSnFWsI6N2NB2NETY3Ydbus4HHvo64SnmxDtPclLUm1uyhotMW7G_8BL16Vzzh45OixEgFsNaCAeBgqQyjNRQ-vu2NMB71oLgEvoZtHQGHpWrwnpHWT71z7BYD3DQthAtR3xGdJ6dEMtfCA2EIyqPH3sJFQ8G49TkO2W2-I_FD98V2S18KEEzTjqJVGCmJ9EEAz2NM0dqgUmhGtOjGOV4iSeri7lxUh3jWwAKHpvbuZApOm6yseQpdas0ux1NUunYeM9n1f5GGbnJLB1Zg8oqQ9WqQFIpzMmw5oWRS8FqqTN0VPe_vHZbB_Q75fwhkK12NI4Nhx8vT8uqvZtxzRLHdT_BbsDcB740RSTSOcMBrjrM1Pmx_cHg1KfiBelm9Vi9YJ0irPtNJdCSlA4_sVoTHr9J3wz4dBb1lg3N12FR1WeON8Nc=&p=3&fvj=0&vjs=3,1 day ago
640,p_5aea8431280bbcba,Boston,data+analyst,TV Data Scientist,LiveRamp,"Boston, MA",Provide mentorship and guidance to other data analysts where necessary. Identify data gaps and advocate for additional data sources to add to solution platform...,"

                                    Similar jobs on Indeed pay $91,000 - $135,000 a year
",https://www.indeed.com/rc/clk?jk=5aea8431280bbcba&fccid=421d3e15a5bff649&vjs=3,4 months ago
641,p_828545f4bbd4c170,Boston,data+analyst,Portfolio Analyst,Whitecap Search,"Boston, MA","Responsible for portfolio data quality and integrity. Prepare client facing communications, including periodic reporting packages....",NOT_FOUND,https://www.indeed.com/rc/clk?jk=828545f4bbd4c170&fccid=4332e6b88ade588a&vjs=3,4 months ago
642,p_c0f3dcbdbe56dc7d,Boston,data+analyst,Health & Benefits Analyst - Boston,Willis Towers Watson,"Boston, MA",Communicate and liaise effectively with colleagues regarding data collection and project execution. Strong analytical and integrative skills including ability...,NOT_FOUND,https://www.indeed.com/rc/clk?jk=c0f3dcbdbe56dc7d&fccid=52f90de7b5346a08&vjs=3,6 days ago
643,p_8d5cfa7cfed6c2c2,Boston,data+analyst,Data QA Specialist,Cendyn,"Reading, MA 01867","Experience in Data Analysis. Work closely with the team’s, management, project managers, business analysts, developers, quality assurance and database...",NOT_FOUND,https://www.indeed.com/rc/clk?jk=8d5cfa7cfed6c2c2&fccid=904e9483c827415b&vjs=3,9 days ago
644,p_a570c473a0871553,Boston,data+analyst,DATA ANALYST- Computational Biology,Massachusetts General Hospital(MGH),"Charlestown, MA","Explore novel data visualization methods, with emphasis on integrating diverse data types and extracting clinically relevant insights....",NOT_FOUND,https://www.indeed.com/rc/clk?jk=a570c473a0871553&fccid=3aaabf5c54e51db9&vjs=3,30+ days ago
645,p_5a1e47d8bad5044d,Boston,data+analyst,Health Research Analyst I,Heath Management Systems,"Danvers, MA",Develop data formatting and cleaning criteria for data from various sources and evaluates relevant data. Ability to comprehend and interpret documents and data....,NOT_FOUND,https://www.indeed.com/company/Heath-Management-Systems/jobs/Health-Research-Analyst-5a1e47d8bad5044d?fccid=f32ce7dcc8dd3690&vjs=3,30+ days ago
646,p_2109f3a8211e9102,Boston,data+analyst,Technical Data Analyst,Arcadia.io,"Burlington, MA",Validate data extracted from complex healthcare systems. 2-4 years as a technical analyst or relative experience:....,NOT_FOUND,https://www.indeed.com/rc/clk?jk=2109f3a8211e9102&fccid=f74a07f61f1a7daa&vjs=3,6 months ago
647,p_750e9660f62da086,Boston,data+analyst,"Analyst, Data Science",Curriculum Associates,"North Billerica, MA 01862","The Analyst, Data Science, will use data to support decision making and improve the experiences of teachers and students that use Curriculum Associates’...","

                                    Similar jobs on Indeed pay $78,000 - $115,000 a year
",https://www.indeed.com/rc/clk?jk=750e9660f62da086&fccid=c5478abdc5ffe11f&vjs=3,30+ days ago
648,p_40a78ebff9b0ea84,Boston,data+analyst,Business Systems Analyst,Akamai,"Cambridge, MA 02139 (Area IV area)","2+ years of experience as a Business Systems Analyst, working with ERP/CRM/enterprise-class systems. Develop an understanding of applications, understand the...","

                                    Similar jobs on Indeed pay $72,000 - $107,000 a year
",https://www.indeed.com/rc/clk?jk=40a78ebff9b0ea84&fccid=9c094dedde5fb497&vjs=3,2 days ago
649,p_d70e4c701f2e94d5,Boston,data+analyst,Criminal Intelligence Analyst,CENTRA Technology,"Boston, MA 02120 (Jamaica Plain area)",HSRAD is looking for a Criminal Intelligence Analyst responsible for providing data and intelligence analysis services focused on the counterterrorism mission...,NOT_FOUND,https://www.indeed.com/rc/clk?jk=d70e4c701f2e94d5&fccid=b3aefa89185b49b3&vjs=3,30+ days ago
650,pj_2ed4269ec24c5a71,Boston,data+analyst,Space Planning Analyst,SAS Retail Services,NOT_FOUND,"We’re looking for Planning Analysts to join our growing team! You’ll learn about consumer insights and how you can use them, along with market data, to meet...",NOT_FOUND,https://www.indeed.com/pagead/clk?mo=r&ad=-6NYlbfkN0D32AtJmRARqp3mPvj2wcN4e_HwHaBMPLToiD5CY_lcraBuK3NPtewIv7Npyc7l_18vb1u4YKklMGm5hp4axQCVHkc6jydTiP2lMu4bPjj096CXorNA7ylyNFGsf-kuyf_5C3RO2i2DT1Z9CEtz0O2bc8DYH1a3F98DgooRAmYFl0vdsf0Widj1JthsIIedsjNZPg-L5mPDPuKcVXZzcOgy1nIxot3k6ddYEABJYTHYik82vscs6U3JGX03q1r9emhoSRnHdfIFlCtJ7OJyb1R0OepEy0SC45SCTwoI8S0M0QRv-iNgb3QW1nUmG3GvwZcvl8X7xMP8a8iCxrpz18LkVjVbpt1VqL1OGyavh_1dtWHH1S3MyYgjNI7FeAN59De6BzVyRH6JV7sTlvr1e3ByAQd04JP6184wJ_wbGn1TydsZyfHKkJZw&p=14&fvj=1&vjs=3,NOT_FOUND
651,pj_dc6afd9175b203fa,Boston,data+analyst,Royalty Analyst,Hachette Book Group,NOT_FOUND,"Validate monthly financial data for month-end general ledger reporting. Excellent organizational skills with the ability to multi-task, prioritize and manage...",NOT_FOUND,https://www.indeed.com/pagead/clk?mo=r&ad=-6NYlbfkN0DL68TXyauRvgJshQFvl0CXX9IUYxuQWsknLS_AKZyJ1tTw4-HnBztNCt23CVimEqwICvoZJFsQhLAIYj6MhI3WnMYTRKwsypUW1W_RXEFQEFo8pLbTS86VATTDSpB-Dn_3QdXm5QeqHJTbhKDxA_n5F4-M1ibHFSui6l_UB831iEwNyc1Lr7rSxtwkhfLD8jxxbFUcEGQmWCeVcrcysqz-StfHlXs3tWQq49FfCIBKXp3m07pqaiuIPBnLe0n0iGtOvVJQFEL5Dn3enmsuJIlaBWJjyVjoxCeTCrzX3gqnHXrvrWhTpSvbzG0cHrXqF9ZWxGFh0lmfOL8U_ZvRz6_3cZgmiogKoyBK35_F3YBzVXAhR-k8bC0FF5P5u2cjzdWSI3JLBvv1H_F8Ah0v2T0K3CqFsVP1Qbpx8uf8QESavs-GRJeJ83LDpcaGZVflztph0ossAKtemxtCpDh_4Tv6TrMLN19UUFvUO6SDdx4xpxpwB3stnXP-5Jwb72PHqaAqDnqjR0uZMwSOdAtUqOYW&p=15&fvj=0&vjs=3,NOT_FOUND
652,pj_2ed4269ec24c5a71,Boston,data+analyst,Space Planning Analyst,SAS Retail Services,NOT_FOUND,"We’re looking for Planning Analysts to join our growing team! You’ll learn about consumer insights and how you can use them, along with market data, to meet...",NOT_FOUND,https://www.indeed.com/pagead/clk?mo=r&ad=-6NYlbfkN0D32AtJmRARqp3mPvj2wcN4e_HwHaBMPLToiD5CY_lcraBuK3NPtewIv7Npyc7l_18vb1u4YKklMGm5hp4axQCVHkc6jydTiP2lMu4bPjj096CXorNA7ylyNFGsf-kuyf_5C3RO2i2DT1Z9CEtz0O2bc8DYH1a3F9-kDDmkK8IB5zcHzZGD2NPSWqr6-CLhb4RESs--XzeFoxa8B3JSE40KOChMVupNEMZmIOeqc6HzQ3S8a0FkrLsI9KuIjxBeSnWjd0JG7MZEu74LbPWYglvDZxW_U4wzAHXwCfCjeqACbAGkT1qg_ZIggcWBQeQ-fKbQ7J9CmcnqwDUiUFSldySlaSSlbN9ZGhelUlid3egwOCrFjOskdB9SwSh-q3z5hrqG49YhMdguZfhKFaQdB_gB2_fzPxr1Vh7iIOiYn1W5ccBhqKAgot-e&p=0&fvj=1&vjs=3,NOT_FOUND
653,pj_dc6afd9175b203fa,Boston,data+analyst,Royalty Analyst,Hachette Book Group,NOT_FOUND,"Validate monthly financial data for month-end general ledger reporting. Excellent organizational skills with the ability to multi-task, prioritize and manage...",NOT_FOUND,https://www.indeed.com/pagead/clk?mo=r&ad=-6NYlbfkN0DL68TXyauRvgJshQFvl0CXX9IUYxuQWsknLS_AKZyJ1tTw4-HnBztNCt23CVimEqwICvoZJFsQhLAIYj6MhI3WnMYTRKwsypUW1W_RXEFQEFo8pLbTS86VATTDSpB-Dn_3QdXm5QeqHLqtQxdjV2jQ_KmhrcrKpH__WbHzdv2ylDr7EWBfHVi3VP2NxFJGribYuo-bi675wXvL91TO_MTqLSVEQXDTaRZn5XzSOFqKoE7SsG1ieL829fH5TNjlVLdaCl8Ai08dUWBw5NTcjnN-CLDXZEfbbB7O5VAPLWMHef304FdqLgUuiJnbzCVCLJQCPbioNQCroZOFqR3TGo9r_VYioxP-pBqGpVIHV4-tRW9OtQDLQjWB7qxWRfuLzZOiuFfjbxRCBj0isL_JHwPwg1qrv_YVvynAMDwOMxh9aFHzUSNwoHqwRSAHrzXRFB2EcYHLTGN6AYIYg8Y-g_haPdREpQgjMaYfgfDhPDOjVU-TeguVxyY9QwxVwmJmYyVQVih0fuUgXNCmImAvk7E1&p=1&fvj=0&vjs=3,NOT_FOUND
654,pj_712a395f5bbb04b8,Boston,data+analyst,QA Data Analyst,HP HOOD,NOT_FOUND,QA Data Analyst - HP Hood. Presents numerical data effectively. Publish data trend analysis reports. Work with department directors to assure data accuracy ....,NOT_FOUND,https://www.indeed.com/pagead/clk?mo=r&ad=-6NYlbfkN0CybCVwhmkLTCIiqD1-ZFQUpj9tFoSiLejrbuvZUvGjhYWHpqHXQ_ylJ37Z_W_bsjcrwm3pRzBKIr8HUuT_KYdfwqQtpd1STWfyyTjtu9tnEEcYONzp-E4RKkCLc4GeCqTyRepGzv_wrlJz-qt8UOhnaFm9csua_ANbThpafMf3f3zepf3Uwy_VIZD3Aiktk9yg4UtR77ibl8FX44R82iwge0m4vU19r2EopnyjrIasq6WnrS09WgnSjmPNYTdYH_8RzpawHOtc9iauvc9cvv_Xxffmkz42IdeIYOzij8WC6s1vWSnfzxtkRVUxbBwRUhucB84UY18dgX5izDf031jP-P0n3lS-pJD-tms_p63GsmodI5_A19DPEgj3qThMVOELreFVlw2ABm_FspWXtxad4n3RWfAsVXkX8DcFtKhCuNttJpTug9zo&p=2&fvj=1&vjs=3,1 day ago
655,p_63e7d80eb17a5673,Boston,data+analyst,"Data Analyst, Transparency & Compliance Operations","Alexion Pharmaceuticals,Inc.","Boston, MA","HCP/HCO Master Data Management (MDM). In addition, the Analyst will leverage internal and external data assets to maximize insights and analytics supporting...",NOT_FOUND,https://www.indeed.com/rc/clk?jk=63e7d80eb17a5673&fccid=cffd7ca8318bd5e2&vjs=3,30+ days ago
656,p_0d56ec691e7eff52,Boston,data+analyst,IT Analyst,Moviri,"Boston, MA 02110 (Central area)","Experience using SQL, scripting languages, and data extraction methods. The IT Analyst will be located in our Boston office....","
                $65,000 - $70,000 a year",https://www.indeed.com/company/Moviri/jobs/IT-Analyst-0d56ec691e7eff52?fccid=425b97487016caea&vjs=3,30+ days ago
657,p_f0e6faed40138ba8,Boston,data+analyst,Data Analyst,Mobile Heartbeat,"Waltham, MA 02453","The Data Analyst reports to the VP of Technical Solutions & Support. In this role, the Data Analyst oversees the collection, collation, interpretation and...",NOT_FOUND,https://www.indeed.com/rc/clk?jk=f0e6faed40138ba8&fccid=840f8cde1dd1aa62&vjs=3,30+ days ago
658,p_4644862490a08fa7,Boston,data+analyst,"Analyst, Marketing Insights - Boston",Brandwatch,"Boston, MA","Proven experience in gathering data, performing analysis, developing in-depth insights and visualising / presenting data findings....",NOT_FOUND,https://www.indeed.com/rc/clk?jk=4644862490a08fa7&fccid=d9caf355bb5b3733&vjs=3,15 days ago
659,p_33f44fca41fa5b6f,Boston,data+analyst,Senior Business Intelligence Analyst,Kyruus,"Boston, MA 02210 (South Boston area)",Senior Business Intelligence Analyst. Manipulate and curate data from a variety of systems. Here’s what that would mean for you in the Senior Business...,NOT_FOUND,https://www.indeed.com/rc/clk?jk=33f44fca41fa5b6f&fccid=057b3bd38660f3a2&vjs=3,2 days ago
660,p_62fdf84be17be690,Boston,data+analyst,Operations Analyst,Quantexa,"Boston, MA",Supporting Sales Operations with data quality and best practice. This is a new role within a rapidly expanding business;...,"
                $70,000 - $80,000 a year",https://www.indeed.com/rc/clk?jk=62fdf84be17be690&fccid=db092f8b7448d6e5&vjs=3,20 days ago
661,p_f1e7a0c28503a980,Boston,data+analyst,QA Analyst,SessionM,"Boston, MA","In this role you will have the unique opportunity to work on a cloud-based, highly scalable Customer Data & Engagement Platform, working directly with clients...",NOT_FOUND,https://www.indeed.com/rc/clk?jk=f1e7a0c28503a980&fccid=7db7c381f86194ad&vjs=3,8 days ago
662,p_02937c77b22d7fef,Boston,data+analyst,Loyalty Operations Analyst,DraftKings,"Boston, MA 02298 (Central area)","Experience in aspects of business intelligence and data engineering, including data warehousing, delivery, and operations....",NOT_FOUND,https://www.indeed.com/rc/clk?jk=02937c77b22d7fef&fccid=2b2d6f212948082d&vjs=3,13 days ago
663,p_d7065d39f611a585,Boston,data+analyst,Value Analyst - Verifi,GCP Applied Technologies,"Cambridge, MA","3 – 5 years of experience in customer success, field support, data analytics, or equivalent. Interpret and prepare reports summarizing this data....",NOT_FOUND,https://www.indeed.com/rc/clk?jk=d7065d39f611a585&fccid=60914ddbb1162b85&vjs=3,30+ days ago
664,p_f46c2c8f9e33cd82,Boston,data+analyst,Underwriting Analyst,DentaQuest,"Boston, MA","3 to 5 years of experience in similar or related capacity. Provide pricing, benefit, trend and other analysis for DentaQuest’s dental and vision programs....",NOT_FOUND,https://www.indeed.com/rc/clk?jk=f46c2c8f9e33cd82&fccid=e51726f3f862bbf5&vjs=3,30+ days ago
665,pj_2a548897181bc9d5,Boston,data+analyst,Marketing Data Analyst II,Carbonite,NOT_FOUND,3 years of work with SFDC data. 3 years / high proficiency with Excel including data model development. There will be data challenges along the way....,NOT_FOUND,https://www.indeed.com/pagead/clk?mo=r&ad=-6NYlbfkN0D-MzrjOb7uwVe1Xuf78MsAvmoxMhYszpdaWZ2BM939nc_X30GhKdWfmnQLUhDP4D8CEDnHxlNbeupi1XJIfPUB8zctsmSk-KyoyHzOZgGceUov532WDgSTypPm13OzKMUrueN0fuQm8thP7w_lZ5L1kpoMf2qXi9ia03qE1ybV8zrd28jWBdqjWT3Je4DlIF8bA_EFqeMCsHUNbIzKWNtZ81gUY8aOQ-Xpjw2scK16emcdnbq6IX3T6czGA_LnYK1613wRmURBIIJhRtGZ5jhahWP6wH5QTr0DgR-rj4eZcGbhV1Vyt4rdMnP_tcWxuxoyLK8oQTrVFpSUvrh4GZAdJzNLzl1B070h4JR_K-UjtZ7DR5gNrw4vAv7nnBrhnAN5urDPpQsgjlKYM39GMSjiatZ0F-d3RCNfckwhtfO3OmXHXBe7OxI8DNpiYpS9igMlH10sAX-kgO-ZqLSHbf8scNdX051Dn6GKpmuvs7O8dzZe2MlVA1TZ5n7ueaTu-ac=&p=13&fvj=0&vjs=3,NOT_FOUND
666,pj_5164f499ca3cbbaf,Boston,data+analyst,Data Analyst,Forward Financing,NOT_FOUND,"As a Data Analyst, you will play an important role in harnessing the Company’s data and analytics to provide valuable insight and analysis that will be used to...",NOT_FOUND,https://www.indeed.com/pagead/clk?mo=r&ad=-6NYlbfkN0CuoFyY3--MdiSzQkIQ3K4ehh0zNtndF9kZFlmc8DmBu-iBShQlMAFb2W7hWrEbC_Wu1VGsSmzxHfAGolcO8QK0TuJeYXMOqWCbLcZ93woKc09ws5uNpTlODrDEauk3Isx1FtHmugwULbhhMrlYK3qAeNIRqlV9NjtcWHCJiJO-YKKR-SDJXAr45BJ7mHZPTef4Dn6AVe4bGCCZfxnXaOuk3f4KDzS8pJsAy8xQ602BOItkkiFun5eNU6TsbuEYDbrSMt4SZrGmtew6pa87HWqJMkPoFZdqbEAsJmPdpcRHw9UYXTuPHciGN93hOabqdlCej3jIW5L9jlmk4x8BqP3uGCoTMBFaft23LRN9Sxuptx0pol-JcwEJnKm_UaNNlRG8-Aj8vLKGE_ygzXCteKPUth0cqkCdS6EjBZZ8UjUTxPFL6dqq76475UnnsYGWVSdmqWmQF-l6EA4-2dI3jxlO7QXaBel0ZGi2xuXvmxBBSTWcD3tsjxlRcy6o1u9NfmA=&p=14&fvj=0&vjs=3,NOT_FOUND
667,pj_37976f5481a32076,Boston,data+analyst,Data Analyst II,CodaMetrix,NOT_FOUND,"Filtering and “cleaning” data by reviewing reports, data files, and performance indicators to expose and plan corrections to code or data problems....",NOT_FOUND,https://www.indeed.com/pagead/clk?mo=r&ad=-6NYlbfkN0AkmEfxfIvywYkr7FPgbbzZtS80TzOGC0Qwk8jq8kfwxcmRMEv4cXPur2iIiy6S-b2A9S63iQ6y273o04DbbDa8DGeXjpHpilpYvUecdh3-r0EnPObskLpHWJaFb7yLqEv7kpqw5OGXyhjkdQmikH0IoosI6KbOOoFdSYwooN51IHKoUEcJY6nrn5GY3uKfmoyoEYMvyvPcFokdtKvwCmETn1HAuf6RnV1h8FZQ6jhT-M6j3m7vZq-t8zapJGHbiHD6ULnIxg33MF21QdGMJID9ynoDQjvcnEwONnvhl2RbDDp2ZOu2peve78AdGyicikXPkDQ0A0_ZCyW_txlH2A5vNEDaeJFO-Y1GMVYRtcmgqw-EoNkHxdXk6I-I9EhuQ8kYECzgCHCbKIbBmHn48zQqFqmtTUGuCTY0cSACZeJK2uJns7GW0-aJ&p=15&fvj=1&vjs=3,3 days ago
668,pj_dc6afd9175b203fa,Boston,data+analyst,Royalty Analyst,Hachette Book Group,NOT_FOUND,"Validate monthly financial data for month-end general ledger reporting. Excellent organizational skills with the ability to multi-task, prioritize and manage...",NOT_FOUND,https://www.indeed.com/pagead/clk?mo=r&ad=-6NYlbfkN0DL68TXyauRvgJshQFvl0CXX9IUYxuQWsknLS_AKZyJ1tTw4-HnBztNCt23CVimEqwICvoZJFsQhLAIYj6MhI3WnMYTRKwsypUW1W_RXEFQEFo8pLbTS86VATTDSpB-Dn_3QdXm5QeqHLv3FaOaDLXp7B7AD3zcPTEaWSSbH9E5NLioGz_uMRHXV2lNjfFAvMObHFZxthSVX8c4zXRzsGy8vJr9-MOmU5Z68iuPNNf8p8viyeN0ISO5RgxPLJxS3N9zdWr27g8W20m4aqkBB7QTVnZNsXpfPTCV3NyrDuvmxHKLyRoxYnMqeeH5gHaCglmKEtBTKhpa9pNuD30pzgLC88oCx-4urjguSXDXeBDmUTGX9LaTFgGWTa4C7jDlR2RJKQZr-hFlxMexSBCpgRHmQwqp7U4thkwyr4NlvjUqY7YD8pZzBu80Ue86tChbFnJcxaFzlEtETXaxiixwmDhXTv5PLd_x7k5hKhwzvsQzoXxQ_oOV3HKq1ANKcoxSOqo5ttDKuOXstxY9X7PgUmrz&p=0&fvj=0&vjs=3,NOT_FOUND
