,unique_id,city,job_qry,job_title,company_name,location,summary,salary,link,date
225,pj_37976f5481a32076,Boston,data+analyst,Data Analyst II,CodaMetrix,NOT_FOUND,"Filtering and “cleaning” data by reviewing reports, data files, and performance indicators to expose and plan corrections to code or data problems....",NOT_FOUND,https://www.indeed.com/pagead/clk?mo=r&ad=-6NYlbfkN0AkmEfxfIvywYkr7FPgbbzZtS80TzOGC0Qwk8jq8kfwxcmRMEv4cXPur2iIiy6S-b2A9S63iQ6y273o04DbbDa8DGeXjpHpilpYvUecdh3-r0EnPObskLpHWJaFb7yLqEv7kpqw5OGXyhjkdQmikH0IRxmmX4wAFQnmFwtI4C9yswY1gqzPgsc0iX3ZSwBxrWFzBjkW2-VRJi5ZOUTNzHCyprCoO3HAILImoPny_NoeKJJZSwT3KA2XaL8tsmd4cwp19Nc8Tb7rn8lSjvu6ZHta3NApeZZPg_v6TQdMgCIdGSrkJPjLJChBwK72KXHek37Hv4Uy1UYiRFZ7j5oaI9qx5Jq8nZroKGZ0QePER5rZeJKUCP82JJa3S26Hf6rLwnAHiBExWsZKTeh-ANSvolWJWyZfJqge_jhbArprDAWiuoeKK_zcWkG1&p=15&fvj=1&vjs=3,3 days ago
226,pj_712a395f5bbb04b8,Boston,data+analyst,QA Data Analyst,HP HOOD,NOT_FOUND,QA Data Analyst - HP Hood. Presents numerical data effectively. Publish data trend analysis reports. Work with department directors to assure data accuracy ....,NOT_FOUND,https://www.indeed.com/pagead/clk?mo=r&ad=-6NYlbfkN0CybCVwhmkLTCIiqD1-ZFQUpj9tFoSiLejrbuvZUvGjhYWHpqHXQ_ylJ37Z_W_bsjcrwm3pRzBKIr8HUuT_KYdfwqQtpd1STWfyyTjtu9tnEEcYONzp-E4RKkCLc4GeCqTyRepGzv_wrlJz-qt8UOhnRjtAz3kiPunTSZe6zXdk815TqkQojJb2aS4toMaGfpJZsxj68FWwc3i7nV2fiMaZaAOe3GSW_uFZ_vb7z2f-ZBKMMhNi1CAzDrbQnp1hsvks-PcK_kQ43Kx7isyGNplxsiZMaX7DI1SJBtAOmD-kqIgyXzE4PW9OK9M20AfXGAjZts129cBROcc9mmZ1dlgv1aAiPZWWYt_tOmJp4zCL92owWOQ8wNz1jU6qRjuMlqfjtVfMiLpliDqqThWD-W8C1juRAJ_aBSDkku7ssqtqhH3OMDH4kOLV&p=16&fvj=1&vjs=3,1 day ago
227,pj_5c24193f260981da,Boston,data+analyst,Health Data Analyst III,BMC HealthNet Plan,NOT_FOUND,3+ years of experience as a medical economics analyst or health data analyst in managed care / insurance industry. Serves as data expert for department....,NOT_FOUND,https://www.indeed.com/pagead/clk?mo=r&ad=-6NYlbfkN0ARNDy9qX-ZLaFI5nphG4ZmPAPbgk81hoWjOObf_Td8g2BfUQgCr94H4M1tF0WAKcQk4QhhBnYXluR61Pn5kLyBwFz48GwU9mYyuC2m8PsCQR5SwiUbWRPGeJbM946izYXn5LBqcIdCMeO1HwdORv5lIOAg6RY49O6k_Q59M_lGQrmWJHG2F2uJofF7y_TA6chAlz3vr3jW9iHY6qq0lMjmZfv_3g1uJKbwPZvttKn55xFrLEytLObmPNVrZc0A2U3dj4hvEZT1_5y_Y_TJZVPo08TnnG-p7pD3p6XYMRsMtx34fv7zWKi2RotvgnbdGDDUYVC6TE6YqmEbYXASorJhhELze1cIIPBPmqz0ycFP3tthMYp4Js48rlDJKTtFi8q-dyPnaDsBzig32DTcb851q9KEBlJq0MzfRxTrXMbeJOyIMWnOwOZfvOViU2nheNuVvccPLLd7vNkb6lLO8RM39mIukSe-cbB4pkl013MtdVam8E2Fx8MHtpFqmzWUzatb5JmFENc_hSUCvgCW_egyNVkQUN_5GVGEVWmx0GDrp0MZ7XCAYd-ZW5KSNCqy-Q4Iqlya4vUdtNSBADG_AbBOnHQ5ge_7yS2SHNYFHz1AAIuQ0N3zZ42-m2vfsUWb1ZK4PB5kXuZ9TGXcKEQWhkYuCx3W3sPECw1YAGDX1ZwyHQ==&p=17&fvj=0&vjs=3,NOT_FOUND
228,pj_5164f499ca3cbbaf,Boston,data+analyst,Data Analyst,Forward Financing,NOT_FOUND,"As a Data Analyst, you will play an important role in harnessing the Company’s data and analytics to provide valuable insight and analysis that will be used to...",NOT_FOUND,https://www.indeed.com/pagead/clk?mo=r&ad=-6NYlbfkN0CuoFyY3--MdiSzQkIQ3K4ehh0zNtndF9kZFlmc8DmBu-iBShQlMAFb2W7hWrEbC_Wu1VGsSmzxHfAGolcO8QK0TuJeYXMOqWCbLcZ93woKc09ws5uNpTlODrDEauk3Isx1FtHmugwULbhhMrlYK3qAxjiU8gHNXGZ2p9iVrKUHXdlS7uEkZhyeSUWu1pfP3BwJwBtYFxh77YYxgvGlOqo5MaJ5jMN2uCfw0JGtrTtyePNlNrkzcurUL66aL3aqnoac6UqoKvz7UpgM2Xg7M_SvqqBu_Kid0EfBdGYmYHhDzSh5iBDS8rNcGr_fKvm9ydOqN_MM53I7lwo-4CfsbsEaOrbyB-n9YFrK-8a1HxX2BKgiY1LZQWjXTw1gIwrQvYFNPkdDISj_C6qKTqrlXbfCPxTVMqgxZ6bYjvmLzVUb6K38javUTDDSd26kIe3uaSGivsyT9ajqgG2bB2gN7qG6-X_sMzViMfcQN4sPle4m1xynPoHtBQnZxXhU8LK9yXc=&p=18&fvj=0&vjs=3,NOT_FOUND
229,p_dffa6d8d6637413f,Boston,data+analyst,Data Analyst,Syrinx,"Boston, MA","Position Overview: We are looking for an Analyst to work in in collaboration with the Research, Portfolio Management and Data teams to develop and implement...",NOT_FOUND,https://www.indeed.com/rc/clk?jk=dffa6d8d6637413f&fccid=da8079cc6582f65e&vjs=3,30+ days ago
230,p_b340c55ab27852a7,Boston,data+analyst,"Data Analyst, Market Performance and Strategy, Analytics",Criteo,"Boston, MA 02109 (Central area)","Who we are At Criteo, we are building the advertising platform of choice for the open Internet, an ecosystem that favors neutrality, transparency and...",NOT_FOUND,https://www.indeed.com/rc/clk?jk=b340c55ab27852a7&fccid=d3ee4a7355a0fb60&vjs=3,30+ days ago
231,p_def58b8add6683d1,Boston,data+analyst,Data Analyst - Big Data,iSeeCars.com,"Woburn, MA 01801","iSeeCars is a rapidly growing Boston area company currently seeking smart, awesome, entrepreneurial talent. If you think you're one of them, please contact us...",NOT_FOUND,https://www.indeed.com/rc/clk?jk=def58b8add6683d1&fccid=45247baafb425fb0&vjs=3,30+ days ago
232,p_d279496d355b2f14,Boston,data+analyst,Product Data Analyst,Mancini Companies,"Mansfield, MA 02048",The Belknap White Group is a nationally ranked top 5 flooring distributor offering residential and commercial customers a diverse portfolio of best-in-class...,NOT_FOUND,https://www.indeed.com/rc/clk?jk=d279496d355b2f14&fccid=7eb0a5a577daf845&vjs=3,19 days ago
233,p_a11049673fe4b8bb,Boston,data+analyst,Financial Services Data Analytics - Experienced Associate,PwC,"Boston, MA 02210 (South Boston area)","A career in our Financial Market Information and Data Analytics practice, within Financial Services Solutions, will provide you the opportunity to use...",NOT_FOUND,https://www.indeed.com/rc/clk?jk=a11049673fe4b8bb&fccid=5e964c4afc56b180&vjs=3,30+ days ago
234,p_4a0ec271cc282179,Boston,data+analyst,Data Warehouse Development Analyst,Partners HealthCare(PHS),"Somerville, MA 02145","Our repository contains over 3 billion individual data points on over 7 million patients. Under the direction of the Senior Manager of Operations, we are...",NOT_FOUND,https://www.indeed.com/rc/clk?jk=4a0ec271cc282179&fccid=26ed24f5b2eebd9b&vjs=3,30+ days ago
235,p_fd679474cfa3958f,Boston,data+analyst,Data Management Business Analyst,BNY Mellon,"Boston, MA","5 plus years’ experience in the financial service industry preferred; Experience with large and complex financial data sets, problem solving, and attention to...",NOT_FOUND,https://www.indeed.com/rc/clk?jk=fd679474cfa3958f&fccid=b4048be2884af072&vjs=3,30+ days ago
236,p_2973ea7290553782,Boston,data+analyst,Sr. Data Science Analyst,MFS Investment Management,"Boston, MA","Whether you're an investment professional, an expert in sales or a technology specialist, you'll find a culture at MFS that supports you in doing what you do...",NOT_FOUND,https://www.indeed.com/rc/clk?jk=2973ea7290553782&fccid=d253247bc4cd436c&vjs=3,2 days ago
237,p_a570c473a0871553,Boston,data+analyst,DATA ANALYST- Computational Biology,Massachusetts General Hospital(MGH),"Charlestown, MA",The Lawrence Lab at the Massachusetts General Hospital Cancer Center seeks a data analyst to join an interdisciplinary team of computational biologists from...,NOT_FOUND,https://www.indeed.com/rc/clk?jk=a570c473a0871553&fccid=3aaabf5c54e51db9&vjs=3,30+ days ago
238,pj_4804aa76b1b91894,Boston,data+analyst,Principal Data Strategy Analyst - US,Liberty Mutual Insurance,NOT_FOUND,"Advance your Career at Liberty Mutual Insurance - A Fortune 100 Company The Principal Analyst, Data Strategy for the Central Data Office will play a critical...","
                $95,801 - $134,100 a year",https://www.indeed.com/pagead/clk?mo=r&ad=-6NYlbfkN0D19kSVUiNzG2UWy1lRGehFMusHrHGUl8ru40ax50wmt70adJ5mjPT43e79jMxsOPhd4xkEdqKilP6KxHBcFMyAW9QkCxU32AbluqOcciVnJXror08imOwQ-k9tuw9L3srXzmOMU1L-bJJbPQHLuuUCSwn42y55uAl4_aUSe3Q2mb6bCavpPjmO-1se6L7qQQdp3fH8hi2s_eZ06KGjlVy8Cql2ULoO8tQTi2Ov1qWEaDc80x4kq6lpeuJyw2kvxzPPejQEI5VvHwr1tqg8vxCeSO5VeDBj9p1PZdFvle6TVfIQjqIW5UhpX_zf1Ex8l1B9moBVQsRxH1qsddSFGHo8auwBV5TaP49nA_irIDAGXbMsMurHpvzVVTicWydKohmodynMrdUgAOOTFMbX4elYkDvRpJTxNgRm_4XME4710RZG7-QQqcKZw3ktpkJwMYqHW1HNmNqZtH8NrO6FTz9Y2SPxUQySaaIdJFy0tcszHfTIRZbXAnDxIP23jKr63bAvccp7nkmYE3yPVjDtFsmhIAmig7ItAhXRq3Gh_mUedKbuJCNjYYHaglWFas9YXce4FvTxTaxkL6WoWeIeO0EkvwyoXEk1GN6vUqpri-ElITHOrcaSFZKwAZsZdxk21BzjGPzPaWW8GpeMnm7-k-p9d-2tzUAlvlOgFi1WkjS-lefLZ-o8eqoaxyznXEwLQ8tjDV0j4ajAvERtotAOO1zQle_WluMSfMYcsZuqwfbRUJ94bjYOYwk7OrfmhVMeGMK92DAGPp-34AISeByy-s5fmc6zxbjiFac87nxqDUN58w==&p=9&fvj=0&vjs=3,NOT_FOUND
239,pj_fb355b19441bb448,Boston,data+analyst,Data Analyst,Indeed Prime,NOT_FOUND,Indeed Prime is a free service that connects qualified job-seekers (that's you) with top companies hiring tech roles. With one application you can be...,NOT_FOUND,https://www.indeed.com/pagead/clk?mo=r&ad=-6NYlbfkN0DhVAxkc_TxySVbUOs6bxWYWOfhmDTNcVTjFFBAY1FXZ-EFN3cXsFacyjbJwnCPXT8pu1IIVxX8o1IMegaEPUNeN__Uobs3YB_VokyltCmkQgRUrRBaM9GC98GdKvjsqlKlqNvKR7vn6vt_wmUifQWoPhqaFCrct1zMyIGIYnpQ9cNn_tJeQoMrkkXT4lE_76H_yDEn3A6jzl7s5M1O1Uggfww-2Nl5iDmuhlqD8hkbtYKcr9s3CjtV7yYjcfwto_wG5WexSe9pqX-ec23KePIBunm26Ig-Pvb71Ih2yiNdNktQhdLjvhVL2YFIQ40ZQ7gnqolld4AHDubvkVdL5hW3-FGzsDwJioTHY8eoe-qclvyXaY6tL5e2WPfOWjVpwR3U9PTpq_mtnRI9zADC0Cz_7brYrys7-LKxewZir5mKlhPD2JYv2_t7HL0u43MhagQ-U5-1NXQNA51VcZC9yXHLDdSV4NUCnIFdVgIm-WuUL99cuYo82ib6SHR2SSLboq4PoN7xqsWC5kF3yMGOq2LTcll5QaGNQ-n3ho7hpra1tw==&p=10&fvj=1&vjs=3,NOT_FOUND
240,pj_5164f499ca3cbbaf,Boston,data+analyst,Data Analyst,Forward Financing,NOT_FOUND,"This is a terrific opportunity for a highly self-motivated individual to join our team. At Forward Financing, our mission is to be the leading provider of...",NOT_FOUND,https://www.indeed.com/pagead/clk?mo=r&ad=-6NYlbfkN0CuoFyY3--MdiSzQkIQ3K4ehh0zNtndF9kZFlmc8DmBu-iBShQlMAFb2W7hWrEbC_Wu1VGsSmzxHfAGolcO8QK0TuJeYXMOqWCbLcZ93woKc09ws5uNpTlODrDEauk3Isx1FtHmugwULbhhMrlYK3qA3zM7XLGTMmBYic-H0gXg020cDoph2LuuZcq-kqd99-QXtdvPVlKnUT7yIN9sfaLbWO80O6Tcqw7gVoTlKAAsW4j8TPogD4ehKj-wE2fefj4o9DtjYBNXc8Dd0fVA7kwsqazme5ZS4gxFDumtZLNoAF83fawKX00IOn48s7iEupXnk30VFQg3kTRigiGRycQ2iva0AxnnlfOIW0Fz_sPMBt515d8YnvAhxfIEk8cWGgQh_cUjPtLGv5adILGc0YZaNM9aIEISgDV7sw_ZknOYLEsWwrBpRwFuXmSjT3RSL_cX5xcGFTgBoTukbl7ewAnACvqONbn9TQT1vUNz-bHmiNKk8OfS3YfUxTpfDupevA4=&p=11&fvj=0&vjs=3,NOT_FOUND
241,pj_37976f5481a32076,Boston,data+analyst,Data Analyst II,CodaMetrix,NOT_FOUND,"5 years relevant experience, strongly focused on analytics; 3 years (Required). Ability to work independently and efficiently under time pressure in a fast-...",NOT_FOUND,https://www.indeed.com/pagead/clk?mo=r&ad=-6NYlbfkN0AkmEfxfIvywYkr7FPgbbzZtS80TzOGC0Qwk8jq8kfwxcmRMEv4cXPur2iIiy6S-b2A9S63iQ6y273o04DbbDa8DGeXjpHpilpYvUecdh3-r0EnPObskLpHWJaFb7yLqEv7kpqw5OGXyhjkdQmikH0IRxmmX4wAFQnLBF2rr4saX54n2nAJkTgDOp5XVcdCJrdNWI4DdW6QXJja4rbm1H04Le89CDxlu1Qv5wocvtUxO5FgZVNyu9es7rqUxGy_nbKveGkj7lTGFziCej-7nU82PuZHqFRa8ZaFyQAIanVeWoN6ZUIClU8ifvRzHNZlMQJBoGsVk5VJqTR1VlymRMZtUIabZh9ltQEl0VHCnjO9ftVwrrg3Q5g1ZZ_9Flpe3rfZs0PtGJTTNaxO66Wx3NdPgQSUIyIzL-_iaX6pFiY_nE71n8oblTro&p=12&fvj=1&vjs=3,3 days ago
242,pj_712a395f5bbb04b8,Boston,data+analyst,QA Data Analyst,HP HOOD,NOT_FOUND,"QA Data Analyst - HP Hood Are you a self-driven person looking to advance your career as a high-impact player on a team? If so, we have an exciting challenge...",NOT_FOUND,https://www.indeed.com/pagead/clk?mo=r&ad=-6NYlbfkN0CybCVwhmkLTCIiqD1-ZFQUpj9tFoSiLejrbuvZUvGjhYWHpqHXQ_ylJ37Z_W_bsjcrwm3pRzBKIr8HUuT_KYdfwqQtpd1STWfyyTjtu9tnEEcYONzp-E4RKkCLc4GeCqTyRepGzv_wrlJz-qt8UOhnvmBjXBEDckb6MVA1lCs4ucNGd0U_NsXaC7fWX1JaqLg0h0B7BAtVVw6K1tx_AuezWdKwbG8ki4Mt_BJ1yzn53LCJV4m-_4p7Ci6g3F3Sl2kj0HJWzWU8py5Ogqzh-AQ9moFziXMt5x_sk-Qiuw6l3gLfrRR06FmMv0PaxkEvpjcpEoT2Fa5V98qzlFgJQ4QrHEPwpln3ssZjXVkui2WV9YQyl8a3Z1PUJIvuwrGbhPmvACTMy0gfULBzG7n6Ijqv21Vsqm9hDdRW1QBmrWS1QX6z6O5dTYG_&p=13&fvj=1&vjs=3,1 day ago
243,pj_5c24193f260981da,Boston,data+analyst,Health Data Analyst III,BMC HealthNet Plan,NOT_FOUND,The Health Data Analyst III is a key member of the Finance management team with responsibility for developing and maintaining analyses to support finance...,NOT_FOUND,https://www.indeed.com/pagead/clk?mo=r&ad=-6NYlbfkN0ARNDy9qX-ZLaFI5nphG4ZmPAPbgk81hoWjOObf_Td8g2BfUQgCr94H4M1tF0WAKcQk4QhhBnYXluR61Pn5kLyBwFz48GwU9mYyuC2m8PsCQR5SwiUbWRPGeJbM946izYXn5LBqcIdCMeO1HwdORv5lIOAg6RY49O4Xi3Bv5y4bwq9ohg4mFMyIhtgfbHI3z30BiA1_M-W_OlGOXnbojuUtXptBBmCvkJyc-7x6tdIdhx2c79gLzpE3p0Kb9IaSlcZh6ZDlSX64wlKwxMqr2N7-5avoHet2xMp-W6XqlFE6UL4XixEd43qr049BACygNc9JBkWMgRdK05WHas4JJ5Holz6pBmidiWnULn7Lc_Nndz64XqwuAlh0wb0HyCY7Oaw80AeLzlBH2nPdBfW6ba_exNCtygSTojpRZlpyjFHwLqS8ez1AAIye2OTQvN0sOMxyXDZ1h2XwlSfKnsT3vlotOAsoMRUSmu2HAC8LDTa7Vhpehm8heDQavIT8LNL90wT-KQYavEgsIAfVVIdIDD27MsT7Ll_zjCUurIIkRdxbQWNz8KzyvVizWOrAdeWrAype-oUI458TiltXi-03aBxPQNy6rim6jwGkMMbiv9u1Mn29mC_aIDq1ryKyQjxlOGxXpIDuPmtxyA2eCg2h9X5JTFxinwfETmYeUVeX4Nl2tA==&p=14&fvj=0&vjs=3,NOT_FOUND
244,p_baaaafce38c6407b,Boston,data+analyst,Senior Data Analyst,Rue Gilt Groupe,"Boston, MA",We're looking for… A Senior Data Analyst to join our Marketing Analytics team and lead efforts to solve some of the most analytically complex questions in a...,NOT_FOUND,https://www.indeed.com/rc/clk?jk=baaaafce38c6407b&fccid=c82361c512ff2aa1&vjs=3,20 days ago
245,p_5164f499ca3cbbaf,Boston,data+analyst,Data Analyst,Forward Financing,"Boston, MA","This is a terrific opportunity for a highly self-motivated individual to join our team. At Forward Financing, our mission is to be the leading provider of...",NOT_FOUND,https://www.indeed.com/rc/clk?jk=5164f499ca3cbbaf&fccid=42ddeab8741527ee&vjs=3,27 days ago
246,p_706d80e8ec11cfb5,Boston,data+analyst,Advisory Analyst,LogicManager,"Boston, MA 02210 (South Boston area)","At LogicManager, customer experience is one of our top priorities, and our Advisory Analysts play a primary role in ensuring an organization’s success....",NOT_FOUND,https://www.indeed.com/rc/clk?jk=706d80e8ec11cfb5&fccid=759d8f7261649293&vjs=3,5 months ago
247,p_fa0f0747dbe6bc51,Boston,data+analyst,Data Analyst,Spy Pond Partners,"Arlington, MA 02476","Highly organized and detail oriented. Spy Pond Partners is a small, dynamic management consulting firm serving transportation and infrastructure management...",NOT_FOUND,https://www.indeed.com/rc/clk?jk=fa0f0747dbe6bc51&fccid=3a0ed1469bf33656&vjs=3,8 months ago
248,p_7312ef3d4d2da97b,Boston,data+analyst,Data Analyst – Capital Markets,Arrayo,"Boston, MA","Minimum 5 years of experience in data analysis functions in the Finance industry. Ability to analyze complex problems, with strong attention to detail and...",NOT_FOUND,https://www.indeed.com/rc/clk?jk=7312ef3d4d2da97b&fccid=7c03eecbe66bc50d&vjs=3,8 months ago
249,p_c91e2e155ced4153,Boston,data+analyst,Data Analyst II,Partners HealthCare(PHS),"Boston, MA 02114 (Back Bay-Beacon Hill area)","As a not-for-profit organization, Partners HealthCare is committed to supporting patient care, research, teaching, and service to the community by leading...",NOT_FOUND,https://www.indeed.com/rc/clk?jk=c91e2e155ced4153&fccid=26ed24f5b2eebd9b&vjs=3,30+ days ago
250,p_81b0d79db60274bd,Boston,data+analyst,Sales Analyst,Medline Industries Inc,"Boston, MA",High school diploma and at least 5 years of experience in sales analysis and support. Analyze business and financial results to support the sales....,NOT_FOUND,https://www.indeed.com/rc/clk?jk=81b0d79db60274bd&fccid=becffc87cf690da3&vjs=3,30+ days ago
251,p_1ea8685a97e5c703,Boston,data+analyst,Reimbursement Cycle Data Analyst,"Foundation Medicine, Inc.","Cambridge, MA 02139 (Area IV area)",Reimbursement Cycle Data Analyst Overview: Foundation Medicine is seeking a talented and highly motivated Reimbursement Cycle Data Analyst to join its...,NOT_FOUND,https://www.indeed.com/rc/clk?jk=1ea8685a97e5c703&fccid=6089b239f938d042&vjs=3,4 months ago
252,p_6a0e171ee5004f95,Boston,data+analyst,Management Analyst,Commonwealth of Massachusetts,"Boston, MA 02114 (Back Bay-Beacon Hill area)","To do well in this role, you need a very fine eye for detail, experience as a data analyst and an understanding of the popular data analysis tools and databases...","
                $49,798 - $70,455 a year",https://www.indeed.com/rc/clk?jk=6a0e171ee5004f95&fccid=4dd38d4e4cf0b7c0&vjs=3,30+ days ago
253,p_65584833f0eda7d9,Boston,data+analyst,Data Analyst / Python Programmer,LogMeIn,"Boston, MA 02210 (South Boston area)",Exceptional attention to detail. The Data Analyst / Python Programmer will report to the Sr....,NOT_FOUND,https://www.indeed.com/rc/clk?jk=65584833f0eda7d9&fccid=b665f01429fa556c&vjs=3,30+ days ago
254,pj_6dc2452979626c70,Boston,data+analyst,Medical Economics Data Analyst,Commonwealth Care Alliance,NOT_FOUND,Strong organizational skills and attention to detail. The Actuarial Services Department makes extensive use of SAS and SQL programs to produce the data and...,NOT_FOUND,https://www.indeed.com/pagead/clk?mo=r&ad=-6NYlbfkN0AvPKJZYie4hMaqdKsGd0vZzY7dSsPLmlqcV6s58mlFZOvCRWW_jxi69njVRGxlsVUn0SwKI2eBQVqKXpxFZ8tBss3XAGxaZJc9iEW3a0oHTa2Llo2DtSgHiZ_E0_58wTYN9DXOYH9bRubw5qeTGYWmVUx9rTM-ls_gFYNQMFmNwnajdbIaWhc7znQdQ14Pha6AbDsLDhZ6LmOAigqdOo7LOFSjN_E98qQ-WKuplZBNE1oVV5wDEFAMHatSjDe8y4MXYwOlGyzJxegBMpQz1u4qQNuU_nZaxQNPXcMj-9RJjifgaUHKCXNh6xDkmFzsJygbu-ITrNss91fFFit98_L2Yd2plDoM8ltoJwCnY2ASgUcdt5xqYpcgGsP4qae-miG--gXWFKDe3sCXon2iK-7KpVoeJlKI5ccYaDVL0UR7VteBWjb4-IxRlnBuYjKN3B-JHq0KsaDW0ss9nzztM3MHT-nf93OobBZJpLlkmpTi5w==&p=10&fvj=0&vjs=3,NOT_FOUND
255,pj_2a548897181bc9d5,Boston,data+analyst,Marketing Data Analyst II,Carbonite,NOT_FOUND,"3 years / high proficiency with Excel including data model development. Experience collecting, organizing, analyzing, and disseminating significant amounts of...",NOT_FOUND,https://www.indeed.com/pagead/clk?mo=r&ad=-6NYlbfkN0D-MzrjOb7uwVe1Xuf78MsAvmoxMhYszpdaWZ2BM939nc_X30GhKdWfmnQLUhDP4D8CEDnHxlNbeupi1XJIfPUB8zctsmSk-KyoyHzOZgGceUov532WDgSTypPm13OzKMUrueN0fuQm8jVYLR6ySrOyW_AJLQMEcr4wVRqIjq7K2Giqg0joaltsf-7CSu8lRVzdr87kMv61ExSOF_K2rnYRRHjZiPEeBu6MPlUTp-wBUy8HP6tfRHPHD84LQ-R5vpOVL8EbPb37udxk-vIwH0w3CmWfRm4TH6j1vjSGjKnciqW8n7CcFLh0MyfVE83HmGsi5mW80fg_XgqMvZcCFKa8YgatgSIV8Ms2dhbsM_MTSAFjr1au1qjRbcRBTmzEPzzhSlf1gzrdTGFZ2oXfVSSC_6RL-gwEzHoOpjYVDoTilRDaS8mkGt3jgemcGj8uq9ynBjbWk8Tzbbm7qz9oMiSQqa9rDgtI7MHDDCgE68YYqF5r6LMTYXxpOr4g8vslS-4=&p=11&fvj=0&vjs=3,NOT_FOUND
256,pj_5164f499ca3cbbaf,Boston,data+analyst,Data Analyst,Forward Financing,NOT_FOUND,"This is a terrific opportunity for a highly self-motivated individual to join our team. At Forward Financing, our mission is to be the leading provider of...",NOT_FOUND,https://www.indeed.com/pagead/clk?mo=r&ad=-6NYlbfkN0CuoFyY3--MdiSzQkIQ3K4ehh0zNtndF9kZFlmc8DmBu-iBShQlMAFb2W7hWrEbC_Wu1VGsSmzxHfAGolcO8QK0TuJeYXMOqWCbLcZ93woKc09ws5uNpTlODrDEauk3Isx1FtHmugwULbhhMrlYK3qAK_K15T0oxlubcb6_vlag6n1rDK6ljWS71fv_NDsuMWbA0fJ_CsnlbLuo5bNe7NYf7SuktLOAGoi_GNUZy0O-ixyaCmaLZIzNOvkoK0_S5XO9RiIDmpBLw25mLKH76OlRGhd0vq0idmicYjjyGsMnUXus-niGaYoWYZ-e-2gY7CVKe3ve7JrncwDf61TKr8-S1kBEDz4LXny_QyvdeOTSv1XwCI4M6oFjs8C8mdYMjQne6nqdT0j9ZOCsUpWlfydxmVOUXrhCoO6gFH2BfkyUM4jGrj7mlJmy5e1eAnl_R_Q_RJ7DUjncGoWWlZzQV5WxSLjPoDp7pK24uchCsowBc5-dxBqhToKbNyIhmKCmjzE=&p=12&fvj=0&vjs=3,NOT_FOUND
257,pj_37976f5481a32076,Boston,data+analyst,Data Analyst II,CodaMetrix,NOT_FOUND,"5 years relevant experience, strongly focused on analytics; 3 years (Required). Ability to work independently and efficiently under time pressure in a fast-...",NOT_FOUND,https://www.indeed.com/pagead/clk?mo=r&ad=-6NYlbfkN0AkmEfxfIvywYkr7FPgbbzZtS80TzOGC0Qwk8jq8kfwxcmRMEv4cXPur2iIiy6S-b2A9S63iQ6y273o04DbbDa8DGeXjpHpilpYvUecdh3-r0EnPObskLpHWJaFb7yLqEv7kpqw5OGXyhjkdQmikH0IRxmmX4wAFQmZBP4yhuty1fzrupCiVCHY7IVpZJTdRcUDat7ni0-3ojLfJvbW9aglI7-JibCi3LFiFH1RAifhuIhu9XXfVZR9oms8c1oMceMwAMFOEETf-sV0CD_1ML8277KI44bY4EEYTGfGV3qWZwB3TYW7SfQp9mnFOUXqzC22sjn3ObZ2wlmtwFgKmsLiSZg70PACaaP8aGn2Oeo2ZZ9wciaWm_2qRWLKm8GSKDC5q5yJbEQSX12RP5Gsi8lv7SHPTQUxH5plCLr6bv_enSqSuQq3i5dY&p=13&fvj=1&vjs=3,3 days ago
258,pj_712a395f5bbb04b8,Boston,data+analyst,QA Data Analyst,HP HOOD,NOT_FOUND,"QA Data Analyst - HP Hood Are you a self-driven person looking to advance your career as a high-impact player on a team? If so, we have an exciting challenge...",NOT_FOUND,https://www.indeed.com/pagead/clk?mo=r&ad=-6NYlbfkN0CybCVwhmkLTCIiqD1-ZFQUpj9tFoSiLejrbuvZUvGjhYWHpqHXQ_ylJ37Z_W_bsjcrwm3pRzBKIr8HUuT_KYdfwqQtpd1STWfyyTjtu9tnEEcYONzp-E4RKkCLc4GeCqTyRepGzv_wrlJz-qt8UOhnlzYDigwEDdRg0ht-cx4q4VicmF07OQKFu4gPIhVLPYEJ5Yci9vVjf06_JzsYoakOepbBxy1LZm36Wna8XH76nuW9r2z4iZYEY6WvN6eGnytdxBvzFL3JabYWJWWoAj_HJXTC5rqNKd4rtOW8o4nBLZFdR3qfYzu0mlY93iNeHTzxGiuG68Ovpdop5Rx353wsynys3dg68Hc5qS7DvbYJXDgXFu8W7wYcGtE2oOS-PLQsLlXdeeNpd3Az6Ou6006tEuce-ypazDnWlcgu4fhcaIypiz1g4XUB&p=14&fvj=1&vjs=3,1 day ago
259,pj_5164f499ca3cbbaf,Boston,data+analyst,Data Analyst,Forward Financing,NOT_FOUND,"This is a terrific opportunity for a highly self-motivated individual to join our team. At Forward Financing, our mission is to be the leading provider of...",NOT_FOUND,https://www.indeed.com/pagead/clk?mo=r&ad=-6NYlbfkN0CuoFyY3--MdiSzQkIQ3K4ehh0zNtndF9kZFlmc8DmBu-iBShQlMAFb2W7hWrEbC_Wu1VGsSmzxHfAGolcO8QK0TuJeYXMOqWCbLcZ93woKc09ws5uNpTlODrDEauk3Isx1FtHmugwULbhhMrlYK3qAblidyCc9MsV5uwzJH-firsHqTV9Vi9yXkyNS54LxLgYh0zkMlilbjJDvoq1Jt7xF553dUR6_MynmJyMwlwMYT2gfirIkGnKsgc_89ak8PpQOfPwWLj1hKT9Wg7nZvVmgr7XDJzlFpTZHAgxPx0jgNXQ5612Me1jd0dI5O3LALTeZWI6cfM9zJRJK_UJEkb9HPCaFjoVy0CKq40MNI3Miko2mV5udpOlXwUJSrIZsHJJAt0Ebq2ETh7Lu96ogZc_cUbf2M976b1Of-6QsnOOXBEhURp3UgO-ZIWe-WWJvV6vFLKFdVabcf_b7MFgLd0lJKiyp2EKrAQS5vNBw-a-Tr44X_U9k8IvzkUhX5A_8II0=&p=0&fvj=0&vjs=3,NOT_FOUND
260,p_b340c55ab27852a7,Boston,data+analyst,"Data Analyst, Market Performance and Strategy, Analytics",Criteo,"Boston, MA 02109 (Central area)","Who we are At Criteo, we are building the advertising platform of choice for the open Internet, an ecosystem that favors neutrality, transparency and...",NOT_FOUND,https://www.indeed.com/rc/clk?jk=b340c55ab27852a7&fccid=d3ee4a7355a0fb60&vjs=3,30+ days ago
261,p_da610d2882def20d,Boston,data+analyst,Data Analyst,Lynn Community Health Center,"Lynn, MA",The Data Analyst is responsible for supporting key initiatives aligned with the organization’s strategy to improve business performance throughout the...,NOT_FOUND,https://www.indeed.com/rc/clk?jk=da610d2882def20d&fccid=bd357d42451eefc1&vjs=3,4 months ago
262,p_a24b09682fd02ddd,Boston,data+analyst,Systems Analyst II - Path to Green Unstructured Data,MLWIZ Team,"Boston, MA",A. Domain Knowledge Needed: Nice to have someone with BFSI and openshares background B. Technical Skills Required: Experience working in infrastructure...,NOT_FOUND,https://www.indeed.com/rc/clk?jk=a24b09682fd02ddd&fccid=3b4511e7fb94c511&vjs=3,30+ days ago
263,p_98514465d81c4f0c,Boston,data+analyst,Data Analyst,Berkshire Grey,"Lexington, MA 02421","Strong analytical skills with the ability to collect, organize, analyze, and disseminate significant amounts of information with attention to detail and...",NOT_FOUND,https://www.indeed.com/rc/clk?jk=98514465d81c4f0c&fccid=30dec79f5d31bd64&vjs=3,30+ days ago
264,p_de7f38b2d8ea5189,Boston,data+analyst,Data Analyst,Bright Horizons Family Solutions,"Watertown, MA 02472","Are you a Data PRO? Have you ever wondered what it would be like to work for an 18 time recipient of Fortune’s Best Places to Work Award? If so, consider...",NOT_FOUND,https://www.indeed.com/rc/clk?jk=de7f38b2d8ea5189&fccid=f88ce7308732d284&vjs=3,13 days ago
265,p_f75bc151f8e91193,Boston,data+analyst,Data Strategy and Reporting Analyst,Bevi,"Boston, MA 02127 (South Boston area)","Bevi is a Series C startup that has raised over $60 million to bring customizable, healthy hydration to offices and facilities across the US and Canada....",NOT_FOUND,https://www.indeed.com/rc/clk?jk=f75bc151f8e91193&fccid=ba211f5dece3b215&vjs=3,30+ days ago
266,p_de8eac24fefeafe3,Boston,data+analyst,Business Analyst/Apprentice Business Analyst,Public Consulting Group,"Boston, MA 02109 (Central area)","Public Consulting Group, Inc. (PCG) provides management consulting and technology services to help public sector education, health, human services, and other...",NOT_FOUND,https://www.indeed.com/rc/clk?jk=de8eac24fefeafe3&fccid=68fb8652f6e72b30&vjs=3,30+ days ago
267,p_cdb0e6d54852590f,Boston,data+analyst,"Data Analyst, Market Performance and Strategy",Criteo,"Boston, MA 02109 (Central area)","Who we are At Criteo, we are building the advertising platform of choice for the open Internet, an ecosystem that favors neutrality, transparency and...",NOT_FOUND,https://www.indeed.com/rc/clk?jk=cdb0e6d54852590f&fccid=d3ee4a7355a0fb60&vjs=3,30+ days ago
268,p_2973ea7290553782,Boston,data+analyst,Sr. Data Science Analyst,MFS Investment Management,"Boston, MA","Whether you're an investment professional, an expert in sales or a technology specialist, you'll find a culture at MFS that supports you in doing what you do...",NOT_FOUND,https://www.indeed.com/rc/clk?jk=2973ea7290553782&fccid=d253247bc4cd436c&vjs=3,2 days ago
269,p_4313febd20583047,Boston,data+analyst,"Research Analyst, Economist/Data Scientist, Global Asset Allocation",Fidelity Investments,"Boston, MA 02212 (Central area)","With over $460 billion in assets under management, Fidelity’s Global Asset Allocation division (GAA) is a leading provider of asset allocation solutions for...",NOT_FOUND,https://www.indeed.com/rc/clk?jk=4313febd20583047&fccid=deb234f9dd3edcea&vjs=3,5 months ago
270,pj_fb355b19441bb448,Boston,data+analyst,Data Analyst,Indeed Prime,NOT_FOUND,Indeed Prime is a free service that connects qualified job-seekers (that's you) with top companies hiring tech roles. With one application you can be...,NOT_FOUND,https://www.indeed.com/pagead/clk?mo=r&ad=-6NYlbfkN0DhVAxkc_TxySVbUOs6bxWYWOfhmDTNcVTjFFBAY1FXZ-EFN3cXsFacyjbJwnCPXT8pu1IIVxX8o1IMegaEPUNeN__Uobs3YB_VokyltCmkQgRUrRBaM9GC98GdKvjsqlKlqNvKR7vn6vt_wmUifQWoo67cUonrcVBxDBg9L8E9kJ5OXrv-UiKg6ubHbKkenh0iLTxKGCQT86HM30iDeRcWnm5uftq-j4S-IxzzoQaN_n5Eg8exEpl1pCNmG9MsOSocxBVdska9RQLrrcTxGQ7Dxrdy2WhlWdXnFyOxGQLrRXUc1p0QTRcBf-764cIixe3DRLlq7IQlcDK4dEP5lRUoqpCJ_zcl1n5w4tTuxkjYE7lJCLcfNW8F27w46n9wig1n6TeR1cNbM2NNhoN4jkIyBMn9FYc8RdCQrnEari--i5-SS80u0nbD-X7vq_2mmP-Cjhas-nHAW_MWdC4miOepDmblc0G1Vyb8_A8xtAg6ICcrlZcPRhhnqOM4rjN7465a6l9gzjD5Do75GcHDv3DbfqX6EdMOvLiCVC0t-93REQ==&p=11&fvj=1&vjs=3,NOT_FOUND
